Last login: Fri Dec 12 13:45:06 on ttys002
zeki@Zekis-MacBook-Air ~ % sudo tcpdump -i en0 -w /tmp/mosaic_capture.pcap &
# Now change volume in Mosaic
# Then stop with: sudo killall tcpdump
# Then analyze: tcpdump -r /tmp/mosaic_capture.pcap | grep -i "192.168.0"
[1] 87908
zsh: command not found: #
zsh: command not found: #
zsh: command not found: #
zeki@Zekis-MacBook-Air ~ % Password:

[1]  + suspended (tty input)  sudo tcpdump -i en0 -w /tmp/mosaic_capture.pcap
zeki@Zekis-MacBook-Air ~ % sudo tcpdump -i en0 -w /tmp/mosaic.pcap
Password:
tcpdump: listening on en0, link-type EN10MB (Ethernet), snapshot length 524288 bytes
^C1121 packets captured
1121 packets received by filter
0 packets dropped by kernel
zeki@Zekis-MacBook-Air ~ % tcpdump -r /tmp/mosaic.pcap | grep "192.168.0" | head -50
reading from file /tmp/mosaic.pcap, link-type EN10MB (Ethernet)
13:48:55.270194 IP oladraserver.home.cslistener > 192.168.0.65.49217: Flags [P.], seq 65862652:65863672, ack 3540897027, win 501, options [nop,nop,TS val 317761807 ecr 4004127767], length 1020
13:48:55.270794 IP 192.168.0.65.49217 > oladraserver.home.cslistener: Flags [.], ack 1020, win 2033, options [nop,nop,TS val 4004130939 ecr 317761807], length 0
13:48:55.270797 IP 192.168.0.65.49245 > 235.109.160.34.bc.googleusercontent.com.https: Flags [.], ack 4150634848, win 8151, length 0
13:48:55.284314 IP 235.109.160.34.bc.googleusercontent.com.https > 192.168.0.65.49245: Flags [.], ack 1, win 2896, options [nop,nop,TS val 1922767322 ecr 3716679543], length 0
13:48:55.293960 IP 192.168.0.65.49218 > oladraserver.home.cslistener: Flags [P.], seq 606945943:606946724, ack 742563478, win 2048, options [nop,nop,TS val 954999859 ecr 317752064], length 781
13:48:55.294158 IP 192.168.0.65.49218 > oladraserver.home.cslistener: Flags [P.], seq 781:875, ack 1, win 2048, options [nop,nop,TS val 954999859 ecr 317752064], length 94
13:48:55.308190 IP oladraserver.home.cslistener > 192.168.0.65.49218: Flags [.], ack 875, win 501, options [nop,nop,TS val 317761845 ecr 954999859], length 0
13:48:55.389381 IP 192.168.0.65.51943 > a172-224-61-5.source.akaquill.net.https: quic, protected
13:48:55.427580 IP a172-224-61-5.source.akaquill.net.https > 192.168.0.65.51943: quic, protected
13:48:55.432967 IP buttercupminim2.home.rfb > 192.168.0.65.59790: Flags [P.], seq 1015596790:1015596824, ack 2486122888, win 2048, options [nop,nop,TS val 1183959923 ecr 1180374012], length 34
13:48:55.433194 IP 192.168.0.65.59790 > buttercupminim2.home.rfb: Flags [.], ack 34, win 47694, options [nop,nop,TS val 1180376103 ecr 1183959923], length 0
13:48:55.607687 IP varese-interface-501e2d68ee7a.home.mdns > mdns.mcast.net.mdns: 0*- [0q] 4/0/0 PTR VarM-CM-(se-Core-ae04ea608ad930203aa073e6cadc29a2._googlecast._tcp.local., (Cache flush) TXT "id=ae04ea608ad930203aa073e6cadc29a2" "cd=28AA0C4D4657250977621E58AD331DCF" "rm=" "ve=05" "md=VarM-CM-(se Core" "ic=/setup/icon.png" "fn=Living room" "ca=199172" "st=0" "bs=FA8FCA6A0F32" "nf=1" "rs=", (Cache flush) SRV ae04ea60-8ad9-3020-3aa0-73e6cadc29a2.local.:8009 0 0, (Cache flush) A 192.168.0.42 (351)
13:48:55.610108 IP varese-interface-501e2d68ee7a.home.mdns > mdns.mcast.net.mdns: 0*- [0q] 4/0/0 PTR ae04ea60-8ad9-3020-3aa0-73e6cadc29a2._googlezone._tcp.local., (Cache flush) TXT "id=28AA0C4D4657250977621E58AD331DCF" "CGS", (Cache flush) SRV ae04ea60-8ad9-3020-3aa0-73e6cadc29a2.local.:10001 700 0, (Cache flush) A 192.168.0.42 (210)
13:48:55.647845 IP 192.168.0.65.59790 > buttercupminim2.home.rfb: Flags [.], ack 34, win 47694, length 0
13:48:55.653385 IP buttercupminim2.home.rfb > 192.168.0.65.59790: Flags [.], ack 1, win 2048, options [nop,nop,TS val 1183960143 ecr 1180376103], length 0
13:48:55.672412 IP 104.18.35.46.https > 192.168.0.65.49238: Flags [P.], seq 1777359502:1777359670, ack 28727117, win 16, options [nop,nop,TS val 3580153623 ecr 4142828939], length 168
13:48:55.672965 IP 192.168.0.65.49238 > 104.18.35.46.https: Flags [.], ack 168, win 2046, options [nop,nop,TS val 4142831435 ecr 3580153623], length 0
13:48:55.675064 IP 192.168.0.65.49238 > 104.18.35.46.https: Flags [P.], seq 1:173, ack 168, win 2048, options [nop,nop,TS val 4142831437 ecr 3580153623], length 172
13:48:55.688817 IP 104.18.35.46.https > 192.168.0.65.49238: Flags [.], ack 173, win 16, options [nop,nop,TS val 3580153640 ecr 4142831437], length 0
13:48:56.012446 IP 235.109.160.34.bc.googleusercontent.com.https > 192.168.0.65.49250: Flags [P.], seq 220990266:220991020, ack 3803109864, win 608, options [nop,nop,TS val 2750558684 ecr 3369135455], length 754
13:48:56.013035 IP 192.168.0.65.49250 > 235.109.160.34.bc.googleusercontent.com.https: Flags [.], ack 754, win 11608, options [nop,nop,TS val 3369137322 ecr 2750558684], length 0
13:48:56.056576 IP 192.168.0.65.49245 > 235.109.160.34.bc.googleusercontent.com.https: Flags [P.], seq 1:48, ack 1, win 8152, options [nop,nop,TS val 3716680547 ecr 1922767322], length 47
13:48:56.070521 IP 235.109.160.34.bc.googleusercontent.com.https > 192.168.0.65.49245: Flags [.], ack 48, win 2896, options [nop,nop,TS val 1922768108 ecr 3716680547], length 0
13:48:56.075764 IP 192.168.0.65.49250 > 235.109.160.34.bc.googleusercontent.com.https: Flags [.], ack 754, win 11607, length 0
13:48:56.089516 IP 235.109.160.34.bc.googleusercontent.com.https > 192.168.0.65.49250: Flags [.], ack 1, win 608, options [nop,nop,TS val 2750558831 ecr 3369137322], length 0
13:48:56.124198 IP 192.168.0.65.51943 > a172-224-61-5.source.akaquill.net.https: quic, protected
13:48:56.137759 IP a172-224-61-5.source.akaquill.net.https > 192.168.0.65.51943: quic, protected
13:48:56.220159 IP 235.109.160.34.bc.googleusercontent.com.https > 192.168.0.65.49245: Flags [P.], seq 1:44, ack 48, win 2896, options [nop,nop,TS val 1922768258 ecr 3716680547], length 43
13:48:56.220727 IP 192.168.0.65.49245 > 235.109.160.34.bc.googleusercontent.com.https: Flags [.], ack 44, win 8152, options [nop,nop,TS val 3716680711 ecr 1922768258], length 0
13:48:56.425880 IP 235.109.160.34.bc.googleusercontent.com.https > 192.168.0.65.49250: Flags [P.], seq 754:889, ack 1, win 608, options [nop,nop,TS val 2750559163 ecr 3369137322], length 135
13:48:56.426465 IP 192.168.0.65.49245 > 235.109.160.34.bc.googleusercontent.com.https: Flags [.], ack 44, win 8151, length 0
13:48:56.426468 IP 192.168.0.65.49250 > 235.109.160.34.bc.googleusercontent.com.https: Flags [.], ack 889, win 11608, options [nop,nop,TS val 3369137735 ecr 2750559163], length 0
13:48:56.428688 IP 192.168.0.65.49250 > 235.109.160.34.bc.googleusercontent.com.https: Flags [P.], seq 1:140, ack 889, win 11608, options [nop,nop,TS val 3369137738 ecr 2750559163], length 139
13:48:56.431992 IP 192.168.0.65.51943 > a172-224-61-5.source.akaquill.net.https: quic, protected
13:48:56.439568 IP 235.109.160.34.bc.googleusercontent.com.https > 192.168.0.65.49245: Flags [.], ack 48, win 2896, options [nop,nop,TS val 1922768477 ecr 3716680711], length 0
13:48:56.445426 IP 235.109.160.34.bc.googleusercontent.com.https > 192.168.0.65.49250: Flags [.], ack 140, win 608, options [nop,nop,TS val 2750559187 ecr 3369137738], length 0
13:48:56.471544 IP a172-224-61-5.source.akaquill.net.https > 192.168.0.65.51943: quic, protected
13:48:56.534307 IP 104.18.35.46.https > 192.168.0.65.49244: Flags [P.], seq 3197285937:3197285996, ack 4266925238, win 15, options [nop,nop,TS val 2611320328 ecr 1350955275], length 59
13:48:56.534904 IP 192.168.0.65.49244 > 104.18.35.46.https: Flags [.], ack 59, win 5887, options [nop,nop,TS val 1350957723 ecr 2611320328], length 0
13:48:56.536900 IP 192.168.0.65.49244 > 104.18.35.46.https: Flags [P.], seq 1:51, ack 59, win 5887, options [nop,nop,TS val 1350957725 ecr 2611320328], length 50
13:48:56.548241 IP 192.168.0.65.59795 > varese-core-8c1f64aa609c.home.7878: Flags [P.], seq 488539260:488539288, ack 1182011593, win 2048, options [nop,nop,TS val 1897177291 ecr 1241131104], length 28
13:48:56.549730 IP 104.18.35.46.https > 192.168.0.65.49244: Flags [.], ack 51, win 15, options [nop,nop,TS val 2611320344 ecr 1350957725], length 0
13:48:56.553855 IP varese-core-8c1f64aa609c.home.7878 > 192.168.0.65.59795: Flags [P.], seq 1:25, ack 28, win 1161, options [nop,nop,TS val 1241136047 ecr 1897177291], length 24
13:48:56.554043 IP 192.168.0.65.59795 > varese-core-8c1f64aa609c.home.7878: Flags [.], ack 25, win 2048, options [nop,nop,TS val 1897177297 ecr 1241136047], length 0
13:48:56.613873 IP 192.168.0.65.59795 > varese-core-8c1f64aa609c.home.7878: Flags [.], ack 25, win 2048, length 0
13:48:56.619153 IP varese-core-8c1f64aa609c.home.7878 > 192.168.0.65.59795: Flags [.], ack 28, win 1161, options [nop,nop,TS val 1241136112 ecr 1897177297], length 0
13:48:57.138316 IP 192.168.0.65.51943 > a172-224-61-5.source.akaquill.net.https: quic, protected
13:48:57.165402 IP a172-224-61-5.source.akaquill.net.https > 192.168.0.65.51943: quic, protected
13:48:57.222949 IP 192.168.0.65.49245 > 235.109.160.34.bc.googleusercontent.com.https: Flags [P.], seq 48:95, ack 44, win 8152, options [nop,nop,TS val 3716681713 ecr 1922768477], length 47
13:48:57.241317 IP oladraserver.home.37740 > 192.168.0.255.32412: UDP, length 21
tcpdump: Unable to write output: Broken pipe
zeki@Zekis-MacBook-Air ~ % sudo tcpdump -i en0 port 7878 -A -s 0
tcpdump: verbose output suppressed, use -v[v]... for full protocol decode
listening on en0, link-type EN10MB (Ethernet), snapshot length 524288 bytes
13:50:10.084321 IP 192.168.0.65.59795 > varese-core-8c1f64aa609c.home.7878: Flags [P.], seq 488553620:488553650, ack 1182037936, win 2048, options [nop,nop,TS val 1897250829 ecr 1241206276], length 30
E..R..@.@......A............Ftw............
q...I.N......E._B.O.k..
Ys..H....;K..2
13:50:10.084753 IP 192.168.0.65.59795 > varese-core-8c1f64aa609c.home.7878: Flags [P.], seq 30:352, ack 1, win 2048, options [nop,nop,TS val 1897250830 ecr 1241206276], length 322
E..v..@.@......A............Ftw......7.....
q...I.N.........(.`r....>..4.;.l.3.....dA;.@.y..L.ZX3p......v.......X{...........U......USlW...n....k6.h..W4._b:.U-.......'....R...e.<...t.y..8j.a\..N...).D..]|Uu........~.5....5....qd.>.4...&..0:.(..6N..O.&.Eg....x]?.z.6+Q..8.b.jJ.f....\....E..Qcy../...1.Q..h\....>.$.~IS@.G{..|.!.}.....+..Z.......A.+...W...n..`..p-=(4..-w...x..
13:50:10.096346 IP varese-core-8c1f64aa609c.home.7878 > 192.168.0.65.59795: Flags [.], ack 352, win 1161, options [nop,nop,TS val 1241209589 ecr 1897250829], length 0
E..4..@.@..........A....Ftw.........x......
I.Z.q..
13:50:10.100557 IP varese-core-8c1f64aa609c.home.7878 > 192.168.0.65.59795: Flags [P.], seq 1:268, ack 352, win 1161, options [nop,nop,TS val 1241209593 ecr 1897250829], length 267
E..?..@.@..........A....Ftw.........^......
I.Z.q........NY'.&k.N.l<..(...x6...(.q.@....N.uF/Oi.k....t......-.;.s.J..0R.?_.</Y.
?..|-.:;.Q...W..N*.f......L....Oth.....E)..%...T..k...m.. e.2....
:...X..K.f.?.....n.dc.'3Gk.<W..............~0uE.]./.......$..s. +..B<....ic.7...<Sq.u~9%'.....j...v....g... ,Ne......".e'p>..
13:50:10.100708 IP 192.168.0.65.59795 > varese-core-8c1f64aa609c.home.7878: Flags [.], ack 268, win 2044, options [nop,nop,TS val 1897250846 ecr 1241209593], length 0
E..4..@.@..!...A............Ftx.....tY.....
q...I.Z.
13:50:10.103416 IP 192.168.0.65.59795 > varese-core-8c1f64aa609c.home.7878: Flags [P.], seq 352:439, ack 268, win 2048, options [nop,nop,TS val 1897250849 ecr 1241209593], length 87
E.....@.@......A............Ftx............
q..!I.Z.....R..*........l6.6...v.U..v..mm....
.'....,K.FH..5..@.,......NR%....H.n,...}ze.......
13:50:10.152656 IP varese-core-8c1f64aa609c.home.7878 > 192.168.0.65.59795: Flags [.], ack 439, win 1161, options [nop,nop,TS val 1241209645 ecr 1897250849], length 0
E..4..@.@..
.......A....Ftx....K....w>.....
I.[-q..!
13:50:10.182339 IP 192.168.0.65.59795 > varese-core-8c1f64aa609c.home.7878: Flags [P.], seq 439:469, ack 268, win 2048, options [nop,nop,TS val 1897250927 ecr 1241209645], length 30
E..R..@.@......A...........KFtx.....@......
q..oI.[-........]I.aN	..5bH${].......n
13:50:10.182443 IP 192.168.0.65.59795 > varese-core-8c1f64aa609c.home.7878: Flags [P.], seq 469:769, ack 268, win 2048, options [nop,nop,TS val 1897250928 ecr 1241209645], length 300
E..`..@.@......A...........iFtx.....:0.....
q..pI.[-....',...[.]...&..f(.Pd.fkF.HzF..B...;
..N...+Gi....=.......P~...pq'd	.qY..:....'_.
..h-..}^..........;..f{,L.dmJ........tR%~.z.Mn..5.........ss...W'..".....r<.V.C.9..9.N....
 "9.....v.i.L.~x[asg...w.d*..J.y}v... .....P.........c........V}E....J.R..0tn.C.,...R.c..fe.....B]n...M.4h...?J.[....e..,.c..
13:50:10.187650 IP varese-core-8c1f64aa609c.home.7878 > 192.168.0.65.59795: Flags [.], ack 469, win 1161, options [nop,nop,TS val 1241209680 ecr 1897250927], length 0
E..4..@.@..	.......A....Ftx....i....v......
I.[Pq..o
13:50:10.187652 IP varese-core-8c1f64aa609c.home.7878 > 192.168.0.65.59795: Flags [.], ack 769, win 1159, options [nop,nop,TS val 1241209680 ecr 1897250928], length 0
E..4..@.@..........A....Ftx.........u......
I.[Pq..p
13:50:10.193432 IP varese-core-8c1f64aa609c.home.7878 > 192.168.0.65.59795: Flags [P.], seq 268:535, ack 769, win 1161, options [nop,nop,TS val 1241209684 ecr 1897250928], length 267
E..?..@.@..........A....Ftx................
I.[Tq..p.........e..f.H:.cV.....c1.......h....qGJ.Wj1ep4.....F. ...6.\;O`..`..=I.y.T.%Ej.P...?X`).K)*.<2.x.j.K.%?u:1.8........vV.s....r.........B..E.[]..#....]....f.;.UJ8.e [.....}.}r{......D.`."`.LE.f..)Z.~...."......Y.Wv..Y...g....	..$.W+....	.	.....c)u~..Y..n.R.:+...(...0
13:50:10.193520 IP 192.168.0.65.59795 > varese-core-8c1f64aa609c.home.7878: Flags [.], ack 535, win 2044, options [nop,nop,TS val 1897250939 ecr 1241209684], length 0
E..4..@.@..!...A............Fty.....p......
q..{I.[T
13:50:10.194173 IP 192.168.0.65.59795 > varese-core-8c1f64aa609c.home.7878: Flags [P.], seq 769:856, ack 535, win 2048, options [nop,nop,TS val 1897250939 ecr 1241209684], length 87
E.....@.@......A............Fty......Z.....
q..{I.[T....R)@..W.e.ZVI.c....	pS...uW..Q.u.....2.@.z....q.j....24.9i..U.*j..=......{e..D.rLs..
13:50:10.196639 IP 192.168.0.65.59795 > varese-core-8c1f64aa609c.home.7878: Flags [P.], seq 856:886, ack 535, win 2048, options [nop,nop,TS val 1897250942 ecr 1241209684], length 30
E..R..@.@......A............Fty............
q..~I.[T......O..^.XN.Xm......lYOM-U..
13:50:10.196727 IP 192.168.0.65.59795 > varese-core-8c1f64aa609c.home.7878: Flags [P.], seq 886:1186, ack 535, win 2048, options [nop,nop,TS val 1897250942 ecr 1241209684], length 300
E..`..@.@......A...........
Fty............
q..~I.[T....',8~x...2g.~.Y........,....!.y...Yg.f...Z.y?#...0.L.Q.._..gu.b....l..|..k	5.N>..w.@g.+.K......]...HO.L........Y..'|.........:l...jJ^h~.8 .G.sy.:Ba.M.....x.,U...i8!`.....]........j.^FB#&xG......Rb..o...cw3..y......0..
..Q..D.....R..l6.d.I......2.`
.!b..Z..U.Tz.'....k+o..<.....is.F./*.#..9.....i.C
13:50:10.201051 IP varese-core-8c1f64aa609c.home.7878 > 192.168.0.65.59795: Flags [.], ack 886, win 1161, options [nop,nop,TS val 1241209694 ecr 1897250939], length 0
E..4..@.@..........A....Fty....
....s......
I.[^q..{
13:50:10.206106 IP varese-core-8c1f64aa609c.home.7878 > 192.168.0.65.59795: Flags [P.], seq 535:802, ack 1186, win 1161, options [nop,nop,TS val 1241209698 ecr 1897250942], length 267
E..?..@.@..........A....Fty....6....U......
I.[bq..~......F........U.j.yZq..o...M.2.u......,h....HJ.....nI#.n..7.Z7.i.......@h..s.r.)]..H...*9....s..,.G...-X....eV..yh.a.	.....>T.c.....6.g..B....=Y./.N.....gC.^.bC...(...YW....c..k<8........V..m.. ...VV.].......s._@n......:....
.7....6..g"./.....5h4y.gz2.............G.
13:50:10.206202 IP 192.168.0.65.59795 > varese-core-8c1f64aa609c.home.7878: Flags [.], ack 802, win 2044, options [nop,nop,TS val 1897250951 ecr 1241209698], length 0
E..4..@.@..!...A...........6Ftz.....n/.....
q...I.[b
13:50:10.206920 IP 192.168.0.65.59795 > varese-core-8c1f64aa609c.home.7878: Flags [P.], seq 1186:1273, ack 802, win 2048, options [nop,nop,TS val 1897250952 ecr 1241209698], length 87
E.....@.@......A...........6Ftz..... ......
q...I.[b....R-}.9...d>......bL.......u.....cK......FZ...S....m_...L...+9.1
J13.`...
BK...3.U...
13:50:10.256561 IP varese-core-8c1f64aa609c.home.7878 > 192.168.0.65.59795: Flags [.], ack 1273, win 1161, options [nop,nop,TS val 1241209749 ecr 1897250952], length 0
E..4..@.@..........A....Ftz.........q......
I.[.q...
13:50:10.298425 IP 192.168.0.65.59795 > varese-core-8c1f64aa609c.home.7878: Flags [P.], seq 1273:1303, ack 802, win 2048, options [nop,nop,TS val 1897251044 ecr 1241209749], length 30
E..R..@.@......A............Ftz............
q...I.[.........E..)....a,%....!.C.C..
13:50:10.298544 IP 192.168.0.65.59795 > varese-core-8c1f64aa609c.home.7878: Flags [P.], seq 1303:1603, ack 802, win 2048, options [nop,nop,TS val 1897251044 ecr 1241209749], length 300
E..`..@.@......A............Ftz.....q!.....
q...I.[.....'=..8..<XY.:.-
....".u?....YP#(.8.E........B...Py.v.M.M....v.+.S....i.l........B9X.3.......:H......R...3..A.).9...*.r.=@.\...w..<w^...u...zY..[....7'..Y..`..~....j0.s..*n.....%\]...hb8...ou........?Q..^........T-)...........KxY%h?.{U]t\..8.*.....g....K........#..
K......O.FB.~.utm...g..a.....<..
13:50:10.303723 IP varese-core-8c1f64aa609c.home.7878 > 192.168.0.65.59795: Flags [.], ack 1303, win 1161, options [nop,nop,TS val 1241209796 ecr 1897251044], length 0
E..4..@.@..........A....Ftz.........pn.....
I.[.q...
13:50:10.303725 IP varese-core-8c1f64aa609c.home.7878 > 192.168.0.65.59795: Flags [.], ack 1603, win 1159, options [nop,nop,TS val 1241209796 ecr 1897251044], length 0
E..4..@.@..........A....Ftz.........oD.....
I.[.q...
13:50:10.314879 IP varese-core-8c1f64aa609c.home.7878 > 192.168.0.65.59795: Flags [P.], seq 802:1257, ack 1603, win 1161, options [nop,nop,TS val 1241209807 ecr 1897251044], length 455
E.....@.@..8.......A....Ftz..........S.....
I.[.q.........]....[.|..Xq@aJ....=...Q....?...n|8..y.].P....[.0..@ef4..U._..9/..*.4..Ksf.^..$p.......<......P..op.n.....>\C7.+L.....h......p..s....tn.n^Z..7..w.....:9b*.@6fh..<...AO.5..g...{.~..:^o.zW.....F.p.jmBOiR.M..O<..t.[......?-Y.	k.Uv.Q:u..^2..O..ad
.r..uP....$..".<....8.s.H..........3....yL..s!....-..4....y.9..O.~..8.....
a.s/h...:.3G.-}......f..nC%	_..2."......7...Gk)JB.&|...f./...k|..@.....~.E..)....F....n......_6H\........Iv..!gh....]..G.. 
.@.....
13:50:10.315107 IP 192.168.0.65.59795 > varese-core-8c1f64aa609c.home.7878: Flags [.], ack 1257, win 2041, options [nop,nop,TS val 1897251060 ecr 1241209807], length 0
E..4..@.@..!...A............Ft|.....i......
q...I.[.
13:50:10.316072 IP 192.168.0.65.59795 > varese-core-8c1f64aa609c.home.7878: Flags [P.], seq 1603:1690, ack 1257, win 2048, options [nop,nop,TS val 1897251061 ecr 1241209807], length 87
E.....@.@......A............Ft|............
q...I.[.....R...H.3.$t,e....6...p8..D.q-H.Y}U.i.Z.)...l.....Iq...0.+.....
e.R.....:H1.z...a..Y+
13:50:10.361675 IP varese-core-8c1f64aa609c.home.7878 > 192.168.0.65.59795: Flags [.], ack 1690, win 1161, options [nop,nop,TS val 1241209853 ecr 1897251061], length 0
E..4. @.@..........A....Ft|.........l......
I.[.q...
13:50:10.964175 IP 192.168.0.65.59795 > varese-core-8c1f64aa609c.home.7878: Flags [P.], seq 1690:1720, ack 1257, win 2048, options [nop,nop,TS val 1897251709 ecr 1241209853], length 30
E..R..@.@......A............Ft|.....db.....
q..}I.[.......}......E...B..{....N.fr?
13:50:10.964326 IP 192.168.0.65.59795 > varese-core-8c1f64aa609c.home.7878: Flags [P.], seq 1720:2020, ack 1257, win 2048, options [nop,nop,TS val 1897251709 ecr 1241209853], length 300
E..`..@.@......A...........LFt|.....,-.....
q..}I.[.....'.....h.[E.s9(...]...fW../'.#uw.7.W...j;p.!.....n..-W.[..@..bf.8B.0.....[. ......+i*<........G...`x.u>n..!.......Z...[....*	.D5......=..N.gq.7."..E..Xg.... c.....#TP....W...k...O...#.vB.>.`.. ......z..\.....kQ)....{a.... .....M....d.-..5.GGK.y........g.x.x.....4@6.N......UG..Z..W
......^.....,..
13:50:10.969480 IP varese-core-8c1f64aa609c.home.7878 > 192.168.0.65.59795: Flags [.], ack 1720, win 1161, options [nop,nop,TS val 1241210462 ecr 1897251709], length 0
E..4.!@.@..........A....Ft|....L....g......
I.^^q..}
13:50:10.969481 IP varese-core-8c1f64aa609c.home.7878 > 192.168.0.65.59795: Flags [.], ack 2020, win 1159, options [nop,nop,TS val 1241210462 ecr 1897251709], length 0
E..4."@.@..........A....Ft|....x....f......
I.^^q..}
13:50:10.974109 IP varese-core-8c1f64aa609c.home.7878 > 192.168.0.65.59795: Flags [P.], seq 1257:1524, ack 2020, win 1161, options [nop,nop,TS val 1241210467 ecr 1897251709], length 267
E..?.#@.@..........A....Ft|....x....8......
I.^cq..}.....]\]H...O.......
-..i....o8.x..q0.{.Oa!..i..:&.9r'...5.kZ..D7c..2.n....O@1y......BXo.(@.R.f....r...	.Xd...)..<.......*.Q....a6n!.fPLy....[...Z..........4.Bn.3.O....R..z.F..>.I.ff..ii@....si..	.~..V.S.sb9..(^}.L.G.	 ..![..{f.Z.S.5..N..].....p.T..r(.;.....oO.	e.od.
13:50:10.974179 IP 192.168.0.65.59795 > varese-core-8c1f64aa609c.home.7878: Flags [.], ack 1524, win 2044, options [nop,nop,TS val 1897251719 ecr 1241210467], length 0
E..4..@.@..!...A...........xFt}.....b......
q...I.^c
13:50:10.975990 IP 192.168.0.65.59795 > varese-core-8c1f64aa609c.home.7878: Flags [P.], seq 2020:2107, ack 1524, win 2048, options [nop,nop,TS val 1897251721 ecr 1241210467], length 87
E.....@.@......A...........xFt}.....y1.....
q...I.^c....R6RcD...P~.V.i....e.j.s..7.4.....
..z..(...{......q...F1=../.H..B....).u2.J.......v
13:50:11.020058 IP varese-core-8c1f64aa609c.home.7878 > 192.168.0.65.59795: Flags [.], ack 2107, win 1161, options [nop,nop,TS val 1241210513 ecr 1897251721], length 0
E..4.$@.@..........A....Ft}.........e......
I.^.q...
13:50:11.066233 IP 192.168.0.65.59795 > varese-core-8c1f64aa609c.home.7878: Flags [P.], seq 2107:2137, ack 1524, win 2048, options [nop,nop,TS val 1897251811 ecr 1241210513], length 30
E..R..@.@......A............Ft}.....H4.....
q...I.^.......i.D.......#<a...R...l..p
13:50:11.066919 IP 192.168.0.65.59795 > varese-core-8c1f64aa609c.home.7878: Flags [P.], seq 2137:2437, ack 1524, win 2048, options [nop,nop,TS val 1897251812 ecr 1241210513], length 300
E..`..@.@......A............Ft}......<.....
q...I.^.....'....$..g&........#mQC.N..^.My .%..ozr...6m...?
..M.^..?
...rV...H.....<o...'......?..7d...q'}.c.Iw.8h:.\..E.......p.....T..Q..)j.6..N4`.8...%D..........|._L..+1......!AYj.J....@.<.i.$`.J;..9hn......IwM..$F~.n<=.p.bw..h3d)>J.(.L.2r.....|Y7J...q......"....	k.x......y..h7../.Q.Ip.)......<.l.wj..Z.
13:50:11.071991 IP varese-core-8c1f64aa609c.home.7878 > 192.168.0.65.59795: Flags [.], ack 2137, win 1161, options [nop,nop,TS val 1241210564 ecr 1897251811], length 0
E..4.%@.@..........A....Ft}.........d[.....
I.^.q...
13:50:11.071993 IP varese-core-8c1f64aa609c.home.7878 > 192.168.0.65.59795: Flags [.], ack 2437, win 1159, options [nop,nop,TS val 1241210564 ecr 1897251812], length 0
E..4.&@.@..........A....Ft}.........c0.....
I.^.q...
13:50:11.082062 IP varese-core-8c1f64aa609c.home.7878 > 192.168.0.65.59795: Flags [P.], seq 1524:1979, ack 2437, win 1161, options [nop,nop,TS val 1241210574 ecr 1897251812], length 455
E....'@.@..0.......A....Ft}..........~.....
I.^.q..........31.<.Z.....T......G.t.c`3?..JJZ...S....t*...K....^u*..m>x....F.}}5...d:t.....*~..B2.p[K....3.k...W...DTv.B>..s.&..u...]..f%.1..7O.q....O..B.J...D.?i........q~I..n..M..>mg.....c..{w...C~..a..\........q-=R.+4.h.V.}MC....#(.}?<...x....X..)...
....W....=[.R.x.b...o,..l9g.['%..`.}.2-.%..1..\.........5...).D.*6..P...]x.....R...3Zo..N...=NS.OEe..	......7&.!.....`|1....k~5..,A....{>'.....NS$).GV9{.Dt. sq.:/>.x3.."B....b..R.......TM.%..
...b....).....U;
13:50:11.082197 IP 192.168.0.65.59795 > varese-core-8c1f64aa609c.home.7878: Flags [.], ack 1979, win 2041, options [nop,nop,TS val 1897251827 ecr 1241210574], length 0
E..4..@.@..!...A............Ft.j....]......
q...I.^.
13:50:11.082557 IP 192.168.0.65.59795 > varese-core-8c1f64aa609c.home.7878: Flags [P.], seq 2437:2467, ack 1979, win 2048, options [nop,nop,TS val 1897251828 ecr 1241210574], length 30
E..R..@.@......A............Ft.j....7>.....
q...I.^.......S...}..U..d....w...+..:f
13:50:11.082678 IP 192.168.0.65.59795 > varese-core-8c1f64aa609c.home.7878: Flags [P.], seq 2467:2767, ack 1979, win 2048, options [nop,nop,TS val 1897251828 ecr 1241210574], length 300
E..`..@.@......A...........7Ft.j....m......
q...I.^.....'...sE...fr..S;.G..7...8.(..4..P.H1...<T.......#.O...J.C. *.......G..m...V./.b1.....|..:e....v.....p..-t`.I.z..c.i....`[..!<.._....c!`.8...8.b.5r.......Im...k..6>8....s.
.$...........e...F=.'*||]mq{..Yqp}b..37.#\un..q.;p.?.$..+Zh.."..e.....w=.AW@......c:.B.B.....?...U...F...<.5.j&*b_h."O...%...

13:50:11.083497 IP 192.168.0.65.59795 > varese-core-8c1f64aa609c.home.7878: Flags [P.], seq 2767:2854, ack 1979, win 2048, options [nop,nop,TS val 1897251829 ecr 1241210574], length 87
E.....@.@......A...........cFt.j...........
q...I.^.....R]E~...Y..@Df^.....X....7....{R....W...|V...._!e..yL. #h......RA.........D..
P.....
13:50:11.087944 IP varese-core-8c1f64aa609c.home.7878 > 192.168.0.65.59795: Flags [.], ack 2767, win 1161, options [nop,nop,TS val 1241210580 ecr 1897251828], length 0
E..4.(@.@..........A....Ft.j...c...._......
I.^.q...
13:50:11.093221 IP varese-core-8c1f64aa609c.home.7878 > 192.168.0.65.59795: Flags [P.], seq 1979:2434, ack 2854, win 1161, options [nop,nop,TS val 1241210585 ecr 1897251829], length 455
E....)@.@..........A....Ft.j........b......
I.^.q......../+Ol.lf.b....*....0F.vG.
{.%.M!(q....JTCS.V....r.
...}.oN#..l. 41~..yc.ui.....>".!#..m.RBK...\...}.%$|..e.Q.d.L|.<.......k.O..sd.T8...]v......c.x,y.Z..y^&.+...^..1;.%.o_L.(.5{M.n'|..o..o......_fN.8.d....=....>...Y?.[,l.....-0.6;.....Ug.c..M..r-dp...^*...E..."U.`p.....j.A...s.......op3.......]..YLQ.'C....;...u...^!T..S%.....vfY..M5.3..A3......]......;.[......2..wu`..a.L+)...Tx...f.{6...$.\...GM....vm8.....A..xXf!/::*"8.\$...\u.L.F*=..~...4...>....
13:50:11.093354 IP 192.168.0.65.59795 > varese-core-8c1f64aa609c.home.7878: Flags [.], ack 2434, win 2041, options [nop,nop,TS val 1897251838 ecr 1241210585], length 0
E..4..@.@..!...A............Ft.1....Z`.....
q...I.^.
13:50:11.094107 IP 192.168.0.65.59795 > varese-core-8c1f64aa609c.home.7878: Flags [P.], seq 2854:2941, ack 2434, win 2048, options [nop,nop,TS val 1897251839 ecr 1241210585], length 87
E.....@.@......A............Ft.1...........
q...I.^.....R.....SsMO..a.d....._...Y<....F.....T..XO...-U.io...%.kx"F.....E.y*....k....2..c.&q
13:50:11.140648 IP varese-core-8c1f64aa609c.home.7878 > 192.168.0.65.59795: Flags [.], ack 2941, win 1161, options [nop,nop,TS val 1241210633 ecr 1897251839], length 0
E..4.*@.@..........A....Ft.1........]H.....
I._	q...
13:50:11.183521 IP 192.168.0.65.59795 > varese-core-8c1f64aa609c.home.7878: Flags [P.], seq 2941:2971, ack 2434, win 2048, options [nop,nop,TS val 1897251929 ecr 1241210633], length 30
E..R..@.@......A............Ft.1...........
q..YI._	.....o.e.9.....F..h.sX.....&G.
13:50:11.183625 IP 192.168.0.65.59795 > varese-core-8c1f64aa609c.home.7878: Flags [P.], seq 2971:3271, ack 2434, win 2048, options [nop,nop,TS val 1897251929 ecr 1241210633], length 300
E..`..@.@......A.........../Ft.1....>A.....
q..YI._	....':.l+.../U.J.l..:..,.-....5..zaB.jtC........w.........,;.....5..7I.y....]9.}Zi......b.....i.....3.......'...	h..TVz.|qP'.ht.....7.Q	.=-..sw:.F.....te.+].@.".W..C.G.w...
9..=....E...2BS..7.Lb.Z".2...Z]..4....$_...TO.<....E...:>....-....Q.1..I..	.Tyt...9{...[..0...g........4.....!X.0..TS:<<..T/O..
13:50:11.188325 IP varese-core-8c1f64aa609c.home.7878 > 192.168.0.65.59795: Flags [.], ack 2971, win 1161, options [nop,nop,TS val 1241210681 ecr 1897251929], length 0
E..4.+@.@..........A....Ft.1.../....\......
I._9q..Y
13:50:11.188328 IP varese-core-8c1f64aa609c.home.7878 > 192.168.0.65.59795: Flags [.], ack 3271, win 1159, options [nop,nop,TS val 1241210681 ecr 1897251929], length 0
E..4.,@.@..........A....Ft.1...[....[v.....
I._9q..Y
13:50:11.195646 IP varese-core-8c1f64aa609c.home.7878 > 192.168.0.65.59795: Flags [P.], seq 2434:2889, ack 3271, win 1161, options [nop,nop,TS val 1241210688 ecr 1897251929], length 455
E....-@.@..*.......A....Ft.1...[...........
I._@q..Y...........c..Fp.....{.1..(..........[d..4wq..G....."f.....K..G...._..l}.hy;.7.;.....{v..p....t.)......T.e..In!.Y.Q..5?..s...7...H.?..\..V.(A.U.@{..&lm5..|.?.z...,.aQ$...nm %i..............F...`l...."...g/p(|.#_..k1^.8...8.h".m?"..
*P....\.@.M.@...m....D9-.td.UyXxk...O.9....Ub.G/<$......ec...........6....d...){{.....q..yNi.'.....).......B....a..*..z#J.Z.R.1%....J$e..'..AG.._.H...5x.#v@=..:.Z......A
........P.....&..].R...........HDo....e...T.D.e.,....
13:50:11.195739 IP 192.168.0.65.59795 > varese-core-8c1f64aa609c.home.7878: Flags [.], ack 2889, win 2041, options [nop,nop,TS val 1897251941 ecr 1241210688], length 0
E..4..@.@..!...A...........[Ft......V*.....
q..eI._@
13:50:11.198880 IP 192.168.0.65.59795 > varese-core-8c1f64aa609c.home.7878: Flags [P.], seq 3271:3358, ack 2889, win 2048, options [nop,nop,TS val 1897251944 ecr 1241210688], length 87
E.....@.@......A...........[Ft.............
q..hI._@....RN.( ,^|.._.vT*.w.1^.D.l.$K	.....{}..);.....~H....8..a..B.i.7$Z{.Z.1M..9........R..
13:50:11.268557 IP varese-core-8c1f64aa609c.home.7878 > 192.168.0.65.59795: Flags [.], ack 3358, win 1161, options [nop,nop,TS val 1241210745 ecr 1897251944], length 0
E..4..@.@..........A....Ft..........Y......
I._yq..h
13:50:11.720840 IP 192.168.0.65.59795 > varese-core-8c1f64aa609c.home.7878: Flags [P.], seq 3358:3386, ack 2889, win 2048, options [nop,nop,TS val 1897252466 ecr 1241210745], length 28
E..P..@.@......A............Ft.............
q..rI._y.....L}..C&.'.le.c@1O..4...l
13:50:11.726113 IP varese-core-8c1f64aa609c.home.7878 > 192.168.0.65.59795: Flags [.], ack 3386, win 1161, options [nop,nop,TS val 1241211218 ecr 1897252466], length 0
E..4./@.@..........A....Ft..........U......
I.aRq..r
13:50:11.726116 IP varese-core-8c1f64aa609c.home.7878 > 192.168.0.65.59795: Flags [P.], seq 2889:2913, ack 3386, win 1161, options [nop,nop,TS val 1241211219 ecr 1897252466], length 24
E..L.0@.@..........A....Ft..........EN.....
I.aSq..r............#t.R.......
13:50:11.726302 IP 192.168.0.65.59795 > varese-core-8c1f64aa609c.home.7878: Flags [.], ack 2913, win 2048, options [nop,nop,TS val 1897252471 ecr 1241211219], length 0
E..4..@.@..!...A............Ft......Qs.....
q..wI.aS
13:50:11.897775 IP 192.168.0.65.59795 > varese-core-8c1f64aa609c.home.7878: Flags [P.], seq 3386:3416, ack 2913, win 2048, options [nop,nop,TS val 1897252643 ecr 1241211219], length 30
E..R..@.@......A............Ft.......|.....
q..#I.aS.....7lIY.J...;r"...Z......_..
13:50:11.898088 IP 192.168.0.65.59795 > varese-core-8c1f64aa609c.home.7878: Flags [P.], seq 3416:3716, ack 2913, win 2048, options [nop,nop,TS val 1897252643 ecr 1241211219], length 300
E..`..@.@......A............Ft......Y......
q..#I.aS....'N.Z.i..L...&.b"v.w. .?9..b..o..f...i#..W.6.B..k.~,........*..n*9..?..8Q...1...Q.1>...R..G.8L.....M.C\^..A4...	.,Fj..@...:..eP.....ui.*T^[/(L.4.Y4..F....0@.7m.....t[..E..}q...jY......<7.V`Ee.n....F.A........../.V..b..Z6.=....O.....L......>..a.e5..v.?.D... ./..}^.."]......w.^..3v..m...ao.........
13:50:11.903813 IP varese-core-8c1f64aa609c.home.7878 > 192.168.0.65.59795: Flags [.], ack 3716, win 1161, options [nop,nop,TS val 1241211396 ecr 1897252643], length 0
E..4.1@.@..........A....Ft..........RC.....
I.b.q..#
13:50:11.905999 IP varese-core-8c1f64aa609c.home.7878 > 192.168.0.65.59795: Flags [P.], seq 2913:3180, ack 3716, win 1161, options [nop,nop,TS val 1241211398 ecr 1897252643], length 267
E..?.2@.@..........A....Ft..........n......
I.b.q..#.......wIr....L.4#FK......k.._..E9.+...C?.....Y.S.z..6
...*..}....=.....jM..B.......PE..7.V!~.......W....b.Az.....;.9....cr........P....".x..,..2".yy`6......r....M	~.....,...........u9...&..._.\g4"fy+....g....~........VI...?..9s..)g.........4.......v<...!|..{W..5$...
13:50:11.906099 IP 192.168.0.65.59795 > varese-core-8c1f64aa609c.home.7878: Flags [.], ack 3180, win 2044, options [nop,nop,TS val 1897252651 ecr 1241211398], length 0
E..4..@.@..!...A............Ft......M......
q..+I.b.
13:50:11.908381 IP 192.168.0.65.59795 > varese-core-8c1f64aa609c.home.7878: Flags [P.], seq 3716:3803, ack 3180, win 2048, options [nop,nop,TS val 1897252654 ecr 1241211398], length 87
E.....@.@......A............Ft.............
q...I.b.....R.F$8.....]..N._......~...+.kR..dHN..R#..	?..k..GR...BC..7,....g]9...
.RmY.a.......
13:50:11.956879 IP varese-core-8c1f64aa609c.home.7878 > 192.168.0.65.59795: Flags [.], ack 3803, win 1161, options [nop,nop,TS val 1241211449 ecr 1897252654], length 0
E..4.3@.@..........A....Ft.....o....P......
I.b9q...
13:50:11.998498 IP 192.168.0.65.59795 > varese-core-8c1f64aa609c.home.7878: Flags [P.], seq 3803:3833, ack 3180, win 2048, options [nop,nop,TS val 1897252744 ecr 1241211449], length 30
E..R..@.@......A...........oFt......V......
q...I.b9........."a..u..;.0......Q.U}.
13:50:11.998768 IP 192.168.0.65.59795 > varese-core-8c1f64aa609c.home.7878: Flags [P.], seq 3833:4133, ack 3180, win 2048, options [nop,nop,TS val 1897252744 ecr 1241211449], length 300
E..`..@.@......A............Ft.......~.....
q...I.b9....'.3....,..p..+Y.......e...~..V.0....:s\.....40...>K..p+.q.'Zy...H.....c.....n...HX.L..........f]M.HX....+.]jb7.]e.3.v...|{-[.5.....x&$@l.e-.'...u].......+] ...@k..)_..`..8m.O.R`.;......YS..X.......|.....n9;..&{.......;...........e..H8....^..\w.;*O.........._....#q^8../..A*.....K.....D
...IL..HjX
13:50:12.011344 IP varese-core-8c1f64aa609c.home.7878 > 192.168.0.65.59795: Flags [.], ack 3833, win 1161, options [nop,nop,TS val 1241211497 ecr 1897252744], length 0
E..4.4@.@..........A....Ft..........O......
I.biq...
13:50:12.011348 IP varese-core-8c1f64aa609c.home.7878 > 192.168.0.65.59795: Flags [.], ack 4133, win 1159, options [nop,nop,TS val 1241211497 ecr 1897252744], length 0
E..4.5@.@..........A....Ft..........N......
I.biq...
13:50:12.011351 IP varese-core-8c1f64aa609c.home.7878 > 192.168.0.65.59795: Flags [P.], seq 3180:3447, ack 4133, win 1161, options [nop,nop,TS val 1241211501 ecr 1897252744], length 267
E..?.6@.@..........A....Ft...........].....
I.bmq.........ck.B.o....M7.c.pn...\...z..
@.Rf..P..;N.Y3P...J......XR.-R.U.6.q...p.....}.6....t....m......M..q4.Fm+..1t. q.....yj..,.z.|......`.g&.&.Dq.Q.....s@..hf..R.....#.9.`4.0H.[j?3..&F...y..R..?..A.I..].qf;Gs.,].^Pq.E..b.j.........'j3..Y..	...;M...g?.pw......&Ol..+x..v
13:50:12.011545 IP 192.168.0.65.59795 > varese-core-8c1f64aa609c.home.7878: Flags [.], ack 3447, win 2044, options [nop,nop,TS val 1897252757 ecr 1241211501], length 0
E..4..@.@..!...A............Ft.&....J>.....
q...I.bm
13:50:12.015285 IP 192.168.0.65.59795 > varese-core-8c1f64aa609c.home.7878: Flags [P.], seq 4133:4220, ack 3447, win 2048, options [nop,nop,TS val 1897252760 ecr 1241211501], length 87
E.....@.@......A............Ft.&.....8.....
q...I.bm....R..,N,.....Q...2.Pv.B..5.Y).t_..l.`n.B......S .Z[..............S.J-.......C.......<
13:50:12.047273 IP 192.168.0.65.59795 > varese-core-8c1f64aa609c.home.7878: Flags [P.], seq 4220:4250, ack 3447, win 2048, options [nop,nop,TS val 1897252792 ecr 1241211501], length 30
E..R..@.@......A............Ft.&....zQ.....
q...I.bm.......5.J
.....DpE.>z.....\..
13:50:12.047537 IP 192.168.0.65.59795 > varese-core-8c1f64aa609c.home.7878: Flags [P.], seq 4250:4550, ack 3447, win 2048, options [nop,nop,TS val 1897252793 ecr 1241211501], length 300
E..`..@.@......A............Ft.&...........
q...I.bm....'$hA.).D.e.j!....V......|........5*.?.+.+.&.u..k:F.L`.-.y...XTw<.Q..!f.x.2!,........./oix."..B.a$^.F....Y<N.	.'.Fve...8.E	.....y;..o.T.,a..8 ...'...e.Yo.........^?..}.&.2.....	E.IIG..........8.....Rl..U0i...{|.........g.......+.g..,.V..@...\
.@h..+..`..*p.....W....UI.].P.5u.X*.C.2I=;.(..z.......
13:50:12.052725 IP varese-core-8c1f64aa609c.home.7878 > 192.168.0.65.59795: Flags [.], ack 4250, win 1161, options [nop,nop,TS val 1241211545 ecr 1897252760], length 0
E..4.7@.@..........A....Ft.&........M......
I.b.q...
13:50:12.057055 IP varese-core-8c1f64aa609c.home.7878 > 192.168.0.65.59795: Flags [P.], seq 3447:3714, ack 4550, win 1161, options [nop,nop,TS val 1241211549 ecr 1897252793], length 267
E..?.8@.@..........A....Ft.&...Z...........
I.b.q........2O....t]....c....aZ..C....Fx=1.W.t]y.m.uLs,$a......-70J.iX.KB.y.EnQ.)'...%Y!..
.UC.J...........OH.._g"(.g....A.....EK.p......*7...P)p...>........W.3.+&.5.....#......C...fX`H."3.....|8.F..	\.$7Te.P.b..|.+.M....A...Ia...Y8...$.......^...A.RF.......3d.)..7....3....
13:50:12.057115 IP 192.168.0.65.59795 > varese-core-8c1f64aa609c.home.7878: Flags [.], ack 3714, win 2044, options [nop,nop,TS val 1897252802 ecr 1241211549], length 0
E..4..@.@..!...A...........ZFt.1....G5.....
q...I.b.
13:50:12.058542 IP 192.168.0.65.59795 > varese-core-8c1f64aa609c.home.7878: Flags [P.], seq 4550:4637, ack 3714, win 2048, options [nop,nop,TS val 1897252804 ecr 1241211549], length 87
E.....@.@......A...........ZFt.1....r1.....
q...I.b.....R\I....~V.....D'....V*.On......:27...i.}..loq9.....6...(..$./.......K..U...[A...W..
13:50:12.104339 IP varese-core-8c1f64aa609c.home.7878 > 192.168.0.65.59795: Flags [.], ack 4637, win 1161, options [nop,nop,TS val 1241211597 ecr 1897252804], length 0
E..4.9@.@..........A....Ft.1........J......
I.b.q...
13:50:12.149542 IP 192.168.0.65.59795 > varese-core-8c1f64aa609c.home.7878: Flags [P.], seq 4637:4667, ack 3714, win 2048, options [nop,nop,TS val 1897252895 ecr 1241211597], length 30
E..R..@.@......A............Ft.1...........
q...I.b........C4...0F!5t.........p...
13:50:12.149664 IP 192.168.0.65.59795 > varese-core-8c1f64aa609c.home.7878: Flags [P.], seq 4667:4967, ack 3714, win 2048, options [nop,nop,TS val 1897252895 ecr 1241211597], length 300
E..`..@.@......A............Ft.1...........
q...I.b.....'t.g..I........5.u..X..%_._-....\.....Eh...#]..k..<.....L;eJ...........&x..9K..m.){..9.I.1.Q.....{.-.p...bN3..3......k.i(o..	Vo..V.x..tqY.5c#v..kB.... .........*'+../u..\...I..mt.-P.t.X.H.........D&..:.f....mA..^..........k}..Y....;e#~./...l......v=X...x8i....<C^7....'<..,. .R[#^{+O.Y..w.d..t.>.
13:50:12.154813 IP varese-core-8c1f64aa609c.home.7878 > 192.168.0.65.59795: Flags [.], ack 4667, win 1161, options [nop,nop,TS val 1241211647 ecr 1897252895], length 0
E..4.:@.@..........A....Ft.1........It.....
I.b.q...
13:50:12.154816 IP varese-core-8c1f64aa609c.home.7878 > 192.168.0.65.59795: Flags [.], ack 4967, win 1159, options [nop,nop,TS val 1241211647 ecr 1897252895], length 0
E..4.;@.@..........A....Ft.1........HJ.....
I.b.q...
13:50:12.165813 IP 192.168.0.65.59795 > varese-core-8c1f64aa609c.home.7878: Flags [P.], seq 4967:4997, ack 3714, win 2048, options [nop,nop,TS val 1897252911 ecr 1241211647], length 30
E..R..@.@......A............Ft.1...........
q../I.b......f........Dr......{}Q.X..=
13:50:12.165933 IP 192.168.0.65.59795 > varese-core-8c1f64aa609c.home.7878: Flags [P.], seq 4997:5297, ack 3714, win 2048, options [nop,nop,TS val 1897252911 ecr 1241211647], length 300
E..`..@.@......A............Ft.1....\......
q../I.b.....'G7.~..@....\G7..E../..s.L.......C..n.yFO....)..P..P..
..QE..L.li...i.?......ShI..G,.A..*.....p.g.).K..v.i...U.`.....-...76_.....z...E.}..ql2h..l)....L........s]...s....62.......FC6]$...D...7.......Mn..,.Q8.!.{.}N....t.....1.....9.L[..J....m tv.K....
=.JL~a...1.r9...[...n~.3.n......f3.M..>...@"n
13:50:12.166367 IP varese-core-8c1f64aa609c.home.7878 > 192.168.0.65.59795: Flags [P.], seq 3714:4169, ack 4967, win 1161, options [nop,nop,TS val 1241211659 ecr 1897252895], length 455
E....<@.@..........A....Ft.1...............
I.c.q.........DfQJbr.T.qYa.....4.......<...$....-......$.^.w\0M..r...
/........lVP..Q.3......{D....$\I.	.>..{N.......S....N..y.&...N	.....Q...).n..kf[6tz.z.H....$.Z. ./.........>.<T26...Ej4.!........IDR...z9.....@....}...5...f.,......tw.......e.#......Q....7..n..%}
..?2Bp.%.#...>.uY..uD.H...].ws...\.-..;8.Cqn..t.b@......!).....|.^5...
.
Z...;...H...@b.p..>A............scP.n.&..l..5n.Y>.1..9..B)q..i..>.j....L.*.....W.........U0I...<.s..5.}...b....S..X.[.>..yZ.
13:50:12.166455 IP 192.168.0.65.59795 > varese-core-8c1f64aa609c.home.7878: Flags [.], ack 4169, win 2041, options [nop,nop,TS val 1897252912 ecr 1241211659], length 0
E..4..@.@..!...A...........EFt......A......
q..0I.c.
13:50:12.167121 IP 192.168.0.65.59795 > varese-core-8c1f64aa609c.home.7878: Flags [P.], seq 5297:5384, ack 4169, win 2048, options [nop,nop,TS val 1897252912 ecr 1241211659], length 87
E.....@.@......A...........EFt.......m.....
q..0I.c.....R...-..P4...di}..e..2......AD...=|..B<%J..h..#%Ri..M.3#..qO.-&:..vK.[....r..W ....h
13:50:12.172528 IP varese-core-8c1f64aa609c.home.7878 > 192.168.0.65.59795: Flags [.], ack 5384, win 1161, options [nop,nop,TS val 1241211665 ecr 1897252911], length 0
E..4.=@.@..........A....Ft..........D......
I.c.q../
13:50:12.177362 IP varese-core-8c1f64aa609c.home.7878 > 192.168.0.65.59795: Flags [P.], seq 4169:4624, ack 5384, win 1161, options [nop,nop,TS val 1241211670 ecr 1897252911], length 455
E....>@.@..........A....Ft...........3.....
I.c.q../.......z5Ria.$..............T..m-&..i	4..'._.........Q.s7....!.=...R..........|+.-[/>.....0..E...i@...2....\t..\."%.......".8.0y..#..[._..#.........$....U(....idhi.w.|nwtn.H^..b......T~..5n....I+T.....\U...Q-MK.5....f7.;.P...aS...5..x.QS1.&.....@...0~vhtD.....ZP...Io...XlY.:....qkw....Q.w'.!.w#i.\fD..uS.]..,..%.Mp.HfvH.=7...
.....xY~T...yK..W.N......}...b..Rr...DQbx..6.._..e....+wd.Y*}T.,..<...Mk...d..5......@..e4_..U......h
...9.......>OT....x]..+.!.
13:50:12.177438 IP 192.168.0.65.59795 > varese-core-8c1f64aa609c.home.7878: Flags [.], ack 4624, win 2041, options [nop,nop,TS val 1897252923 ecr 1241211670], length 0
E..4..@.@..!...A............Ft......?v.....
q..;I.c.
13:50:12.180934 IP 192.168.0.65.59795 > varese-core-8c1f64aa609c.home.7878: Flags [P.], seq 5384:5471, ack 4624, win 2048, options [nop,nop,TS val 1897252926 ecr 1241211670], length 87
E.....@.@......A............Ft.............
q..>I.c.....RE".....P.j...=....k.... =g(.R.RQ.N....2b....s{_.....U..Al.......=....9,..,.g.<...5
13:50:12.228172 IP varese-core-8c1f64aa609c.home.7878 > 192.168.0.65.59795: Flags [.], ack 5471, win 1161, options [nop,nop,TS val 1241211721 ecr 1897252926], length 0
E..4.?@.@..........A....Ft..........BY.....
I.cIq..>
13:50:12.267117 IP 192.168.0.65.59795 > varese-core-8c1f64aa609c.home.7878: Flags [P.], seq 5471:5501, ack 4624, win 2048, options [nop,nop,TS val 1897253012 ecr 1241211721], length 30
E..R..@.@......A............Ft.............
q...I.cI.....2V.........U.Yn_....IM`*z
13:50:12.267226 IP 192.168.0.65.59795 > varese-core-8c1f64aa609c.home.7878: Flags [P.], seq 5501:5801, ack 4624, win 2048, options [nop,nop,TS val 1897253012 ecr 1241211721], length 300
E..`..@.@......A............Ft.............
q...I.cI....';.zJy...5...P7...MQ.:`....s....%..e..E...>nh..y.d...a..&q...%%S}}.E...KBY|.hL.........'..f.....d.....o.|.i..4..w.W.aY. @.........8.R.q.......2.
...)._..)=du....H.@....n..kj...#(.m).?...h4.......X.Y....:..ZV....jO.&93..><..j..wx...fhy...e.<.......6.;".7G...m3..
EkL.f+.<l0`.\...;..G2......ml>...~
13:50:12.272870 IP varese-core-8c1f64aa609c.home.7878 > 192.168.0.65.59795: Flags [.], ack 5801, win 1161, options [nop,nop,TS val 1241211765 ecr 1897253012], length 0
E..4.@@.@..........A....Ft.....=....@......
I.cuq...
13:50:12.279168 IP varese-core-8c1f64aa609c.home.7878 > 192.168.0.65.59795: Flags [P.], seq 4624:5079, ack 5801, win 1161, options [nop,nop,TS val 1241211772 ecr 1897253012], length 455
E....A@.@..........A....Ft.....=....0H.....
I.c|q........s..0.....<.@..v....".8..f+.!.%.g...~Y..../....)Sr.j.9.:..*...tE..	.._.z]f@.....&N..-..&..@..H..J...h7..r.....O....A.O..t"	.az]R...	W...[D...=..........._Y....:.....2..p..J.R..2.^..G?....Ex...@...[,.c...0!F.T...Li.\.......~q.D.......%3.*mx0.]......ei{..y.e....d...=...m...O`...B.."..+/p.\.q....Q...1.L.6....b......J7.........Mql:8...Z.k.Ka..l..v.....[*..k.(....J...,.Ae.2^...?o...#..]>K.....2&/.x.t......!.;./...3....j....Yx.KYV.F.S..........7..52;.
<
13:50:12.279248 IP 192.168.0.65.59795 > varese-core-8c1f64aa609c.home.7878: Flags [.], ack 5079, win 2041, options [nop,nop,TS val 1897253024 ecr 1241211772], length 0
E..4..@.@..!...A...........=Ft......;C.....
q...I.c|
13:50:12.282426 IP 192.168.0.65.59795 > varese-core-8c1f64aa609c.home.7878: Flags [P.], seq 5801:5888, ack 5079, win 2048, options [nop,nop,TS val 1897253028 ecr 1241211772], length 87
E.....@.@......A...........=Ft.......7.....
q...I.c|....R$.	....-.....).	..R...%.yu..i@8#..O./c...4...|VY..>.....a..<.......=.`..../x....!.
13:50:12.328674 IP varese-core-8c1f64aa609c.home.7878 > 192.168.0.65.59795: Flags [.], ack 5888, win 1161, options [nop,nop,TS val 1241211821 ecr 1897253028], length 0
E..4.B@.@..........A....Ft..........>'.....
I.c.q...
13:50:13.031072 IP 192.168.0.65.59795 > varese-core-8c1f64aa609c.home.7878: Flags [P.], seq 5888:5918, ack 5079, win 2048, options [nop,nop,TS val 1897253776 ecr 1241211821], length 30
E..R..@.@......A............Ft.......0.....
q...I.c..........1.(.1..e;oF.....kI\).
13:50:13.031434 IP 192.168.0.65.59795 > varese-core-8c1f64aa609c.home.7878: Flags [P.], seq 5918:6218, ack 5079, win 2048, options [nop,nop,TS val 1897253777 ecr 1241211821], length 300
E..`..@.@......A............Ft.......H.....
q...I.c.....'.. -.oo.;..2.w..q.!..}M..........2f.&....i...
.[...	./`.,b.>.C@D[.%
.W..]g]@?Oh..U.n.3I....YQ..g.7.!s...s..Z.*.o0....2&....xC,.o.....<:...Y%~..I.Yl.W
..o..;^.;.}.z..g..h..s.#./.?w./hv.'m..+9..".8o.:..... .._R.X.......0...b.<I......I.......gi..O.Q.@Q.DHuB..wJ.@..D@..*....."c......#.G#.....D.:..I
13:50:13.036410 IP varese-core-8c1f64aa609c.home.7878 > 192.168.0.65.59795: Flags [.], ack 5918, win 1161, options [nop,nop,TS val 1241212529 ecr 1897253776], length 0
E..4.C@.@..........A....Ft..........8Y.....
I.fqq...
13:50:13.036414 IP varese-core-8c1f64aa609c.home.7878 > 192.168.0.65.59795: Flags [.], ack 6218, win 1159, options [nop,nop,TS val 1241212529 ecr 1897253777], length 0
E..4.D@.@..........A....Ft..........7......
I.fqq...
13:50:13.041030 IP varese-core-8c1f64aa609c.home.7878 > 192.168.0.65.59795: Flags [P.], seq 5079:5346, ack 6218, win 1161, options [nop,nop,TS val 1241212533 ecr 1897253777], length 267
E..?.E@.@..........A....Ft.................
I.fuq........VA
..jiq.i....J..%....,.p6...>.....)...F.(..z........|.\jq...5]... ...m..(....+..wB....P.S.J{v..i`...........y.u........B..N. 1{...;.O.RoHi'v.u.....G+.~....|d..%.....B..Gk....O.B+....Jbt,t./	....^...h...8.....G..^.;L;.t.S|...mj0.3.A
..S.b..'...........O.q`tO.yA.
13:50:13.041144 IP 192.168.0.65.59795 > varese-core-8c1f64aa609c.home.7878: Flags [.], ack 5346, win 2044, options [nop,nop,TS val 1897253786 ecr 1241212533], length 0
E..4..@.@..!...A............Ft......2......
q...I.fu
13:50:13.042988 IP 192.168.0.65.59795 > varese-core-8c1f64aa609c.home.7878: Flags [P.], seq 6218:6305, ack 5346, win 2048, options [nop,nop,TS val 1897253788 ecr 1241212533], length 87
E.....@.@......A............Ft......:0.....
q...I.fu....R.a^=."..5...oU............W.\.>...	>B.Km....D..m	S...XNb	......4....+Cl	.4m.	....\
13:50:13.092638 IP varese-core-8c1f64aa609c.home.7878 > 192.168.0.65.59795: Flags [.], ack 6305, win 1161, options [nop,nop,TS val 1241212585 ecr 1897253788], length 0
E..4.F@.@..........A....Ft.....5....5......
I.f.q...
13:50:13.134536 IP 192.168.0.65.59795 > varese-core-8c1f64aa609c.home.7878: Flags [P.], seq 6305:6335, ack 5346, win 2048, options [nop,nop,TS val 1897253880 ecr 1241212585], length 30
E..R..@.@......A...........5Ft.............
q...I.f..........#...........p..b.eh..
13:50:13.134693 IP 192.168.0.65.59795 > varese-core-8c1f64aa609c.home.7878: Flags [P.], seq 6335:6635, ack 5346, win 2048, options [nop,nop,TS val 1897253880 ecr 1241212585], length 300
E..`..@.@......A...........SFt.............
q...I.f.....'VnN7 .. b..`........*.\..9.".FOZ.U....;|.;k..*.2.3
Jj.....Q..._.S...Y...[.^....b.q...D.P..&_d...1..C...G..t...0%.yE.n.	.B.V6K:..q..~"H7.....p...mo.v.#..P}. ..:.>..?......7..	...A.s.$r}.....<.{....b..w".M:.NTY...D....J..Y........<...h.I.cB.......?
...MF.....;...Q.j.s..\.dIH.h...;..n.6... .u.....
13:50:13.139693 IP varese-core-8c1f64aa609c.home.7878 > 192.168.0.65.59795: Flags [.], ack 6335, win 1161, options [nop,nop,TS val 1241212632 ecr 1897253880], length 0
E..4.G@.@..........A....Ft.....S....4......
I.f.q...
13:50:13.139696 IP varese-core-8c1f64aa609c.home.7878 > 192.168.0.65.59795: Flags [.], ack 6635, win 1159, options [nop,nop,TS val 1241212632 ecr 1897253880], length 0
E..4.H@.@..........A....Ft..........3......
I.f.q...
13:50:13.144462 IP varese-core-8c1f64aa609c.home.7878 > 192.168.0.65.59795: Flags [P.], seq 5346:5613, ack 6635, win 1161, options [nop,nop,TS val 1241212637 ecr 1897253880], length 267
E..?.I@.@..........A....Ft........... .....
I.f.q........_.....7...g.;.	.U]....
....;V...x.,!...c....h."..gU..F.{..<..5..e.-d.\p.v@....DX....;.L.EO.N.....\..^..l..8...,n.T..../...a..".........|n..{q...KG...<;.......gK.y.b.CV.|r....-...FI\.jl.G.....T...r[Jt.o9..iQ#.o.Qg2.q............Rr.I..d...m.......E.:9....{:Y
N..D.
13:50:13.144611 IP 192.168.0.65.59795 > varese-core-8c1f64aa609c.home.7878: Flags [.], ack 5613, win 2044, options [nop,nop,TS val 1897253890 ecr 1241212637], length 0
E..4..@.@..!...A............Ft....../%.....
q...I.f.
13:50:13.150101 IP 192.168.0.65.59795 > varese-core-8c1f64aa609c.home.7878: Flags [P.], seq 6635:6943, ack 5613, win 2048, options [nop,nop,TS val 1897253895 ecr 1241212637], length 308
E..h..@.@......A............Ft.......y.....
q...I.f...../..V.|..	z.&..G.yC.Ke
GD..?8rB......5...q..J4v.G..P...[...^.....gF...<...2.~...U.H+.. ...K.a.~...yS...]....@*....L.&. <..K..9{.....Fbe..;..l8.t......	..v......]t.&i..'.+E..`..).D...z..c!~.........dg..,.I.X.~T.|.m.|}.L^..L|FwR]...pPNI.....~y`..}.Q../.'.o\>....(...*.iW....1?[..vk..........A.......S
.+.8.X
13:50:13.150587 IP 192.168.0.65.59795 > varese-core-8c1f64aa609c.home.7878: Flags [P.], seq 6943:7030, ack 5613, win 2048, options [nop,nop,TS val 1897253896 ecr 1241212637], length 87
E.....@.@......A............Ft......0_.....
q...I.f.....R...(.bN)... ....	.|....Y.H..U.Rs....U.<8mD...J..nh...,&\.K.........d.`...{......x.
13:50:13.155855 IP varese-core-8c1f64aa609c.home.7878 > 192.168.0.65.59795: Flags [.], ack 7030, win 1161, options [nop,nop,TS val 1241212648 ecr 1897253895], length 0
E..4.J@.@..........A....Ft.....
....0......
I.f.q...
13:50:13.164553 IP varese-core-8c1f64aa609c.home.7878 > 192.168.0.65.59795: Flags [P.], seq 5613:6068, ack 7030, win 1161, options [nop,nop,TS val 1241212657 ecr 1897253895], length 455
E....K@.@..........A....Ft.....
...........
I.f.q........<...C...D..M..t	_.......B.".4Ui........)k#<.......3.	F<.wV.._..Ru{.....C..y..le..........W.......:..br..<...5....X....fI.\.2.......x.V........A:T.........d..._\.....2..1....
v...6..(..W.O......w;bM.w.v.{...$^
...O6.....L...u......S..V[%c.f"i.Ed^.....)....L.O|.....(..9.z_....We
....0.+,.A......1.=......U..&..2.U.D..(.H.\..`........$.B....`...,#..+.8 y.;.f.^..3d.(.L"r.*..U9u...J....s',<.).$...?...;*.xr....sM.u}.6..l.3......l....oSp.E.......11.:....
13:50:13.164646 IP 192.168.0.65.59795 > varese-core-8c1f64aa609c.home.7878: Flags [.], ack 6068, win 2041, options [nop,nop,TS val 1897253910 ecr 1241212657], length 0
E..4..@.@..!...A...........
Ft.c....+......
q...I.f.
13:50:13.166459 IP 192.168.0.65.59795 > varese-core-8c1f64aa609c.home.7878: Flags [P.], seq 7030:7117, ack 6068, win 2048, options [nop,nop,TS val 1897253912 ecr 1241212657], length 87
E.....@.@......A...........
Ft.c....	......
q...I.f.....R{.R..."H.M.i...e......n^]`..[..DF.a......p[.O ...-	.o......i*.+.....l.{.\.%6......
13:50:13.212116 IP varese-core-8c1f64aa609c.home.7878 > 192.168.0.65.59795: Flags [.], ack 7117, win 1161, options [nop,nop,TS val 1241212705 ecr 1897253912], length 0
E..4.L@.@..........A....Ft.c...a...........
I.g!q...
13:50:13.251847 IP 192.168.0.65.59795 > varese-core-8c1f64aa609c.home.7878: Flags [P.], seq 7117:7147, ack 6068, win 2048, options [nop,nop,TS val 1897253997 ecr 1241212705], length 30
E..R..@.@......A...........aFt.c....,......
q..mI.g!................!.=..ity.Ki.
l
13:50:13.251954 IP 192.168.0.65.59795 > varese-core-8c1f64aa609c.home.7878: Flags [P.], seq 7147:7447, ack 6068, win 2048, options [nop,nop,TS val 1897253997 ecr 1241212705], length 300
E..`..@.@......A............Ft.c.....l.....
q..mI.g!....'\.m.].H:u1...(.s.f;....:..-...$b..~..c.2.w..'...qa.O.	,.4...4....u....Y...g*n.....	}.......gL.....u.x.r.P...S...f....@CmR.,...+.q...DCf....E..0.S......V.5]....h........T...H...#6.......
.G'Sl.%......[....TT.....5
R?.sH.i.....4.p..>o..g...G.../.....VF>...}....u.....f...c
uc.z.....T...a..w}.... .
13:50:13.257078 IP varese-core-8c1f64aa609c.home.7878 > 192.168.0.65.59795: Flags [.], ack 7147, win 1161, options [nop,nop,TS val 1241212750 ecr 1897253997], length 0
E..4.M@.@..........A....Ft.c........-......
I.gNq..m
13:50:13.257081 IP varese-core-8c1f64aa609c.home.7878 > 192.168.0.65.59795: Flags [.], ack 7447, win 1159, options [nop,nop,TS val 1241212750 ecr 1897253997], length 0
E..4.N@.@..........A....Ft.c........,......
I.gNq..m
13:50:13.265070 IP varese-core-8c1f64aa609c.home.7878 > 192.168.0.65.59795: Flags [P.], seq 6068:6523, ack 7447, win 1161, options [nop,nop,TS val 1241212757 ecr 1897253997], length 455
E....O@.@..........A....Ft.c........7......
I.gUq..m......vaAF<..e.....+.:..o2i.Y......Ud.....xu........q.".9.....A...f.S?..L..*....E#...].1l..v.......C].Luo...G.o.g..s.0. ..X...{.Vf..K.O .....om.^"..P,%.>t(n. ......`.....9t.....m.....w]
.;....&. ...ctL.OFz.y.*..N...O..Wr*..W....4.uJ_..a.?A;/.#.........}&...:4.z6Q.s.1j.ES2......G...n..;D.">...m..I..`...K....m..Vo...9..	d.j.sV.z..........2l.......,...C.Lm........o.X.i....&a.... .D6.-~..!.\..4_!]............d...AU+Z6..@.1wB..V.+...y.Y..-"......?.f..!.x..
13:50:13.265189 IP 192.168.0.65.59795 > varese-core-8c1f64aa609c.home.7878: Flags [.], ack 6523, win 2041, options [nop,nop,TS val 1897254010 ecr 1241212757], length 0
E..4..@.@..!...A............Ft.*....'~.....
q..zI.gU
13:50:13.266618 IP 192.168.0.65.59795 > varese-core-8c1f64aa609c.home.7878: Flags [P.], seq 7447:7477, ack 6523, win 2048, options [nop,nop,TS val 1897254012 ecr 1241212757], length 30
E..R..@.@......A............Ft.*.....W.....
q..|I.gU.....j.........C.C.J..B...p..S
13:50:13.266736 IP 192.168.0.65.59795 > varese-core-8c1f64aa609c.home.7878: Flags [P.], seq 7477:7777, ack 6523, win 2048, options [nop,nop,TS val 1897254012 ecr 1241212757], length 300
E..`..@.@......A............Ft.*....z......
q..|I.gU....'j......w>m.{s.mn. .).....n...ds,...W...........v..Y+?z...R....<M..N-...<:...UK.....k4.ZSa.O.|.wK.. ...u?."fz.3.."...........t.`...........Z.:J.I.B..k..N....F.....}3.N...9...D5E..{<.T..G..:..
..+.........=.........RR...g.X..[Jr...6B...*..f~...)P.R...\..&e..Gt............
*...D.+.kf....?8.b.{l.C.
13:50:13.267602 IP 192.168.0.65.59795 > varese-core-8c1f64aa609c.home.7878: Flags [P.], seq 7777:7864, ack 6523, win 2048, options [nop,nop,TS val 1897254013 ecr 1241212757], length 87
E.....@.@......A............Ft.*...........
q..}I.gU....R.....3.yL.7y.......U....(w.	.mDp....!..v	#.:8b..>...N....y...% ...U.\!.qqH	...gj[.
13:50:13.272437 IP varese-core-8c1f64aa609c.home.7878 > 192.168.0.65.59795: Flags [.], ack 7864, win 1161, options [nop,nop,TS val 1241212764 ecr 1897254012], length 0
E..4.P@.@..........A....Ft.*...L....)D.....
I.g\q..|
13:50:13.272440 IP varese-core-8c1f64aa609c.home.7878 > 192.168.0.65.59795: Flags [P.], seq 6523:6790, ack 7864, win 1161, options [nop,nop,TS val 1241212766 ecr 1897254012], length 267
E..?.Q@.@..........A....Ft.*...L.....0.....
I.g^q..|.......J......XBg....!@R...C..v..`..."INL.H..XCF_i....r..,9I.<AM...W...5.j....4.j...e.......3.V,...u.B..O...w.D`{...................-.N.....<vP.n..
..8.........H..3.Q..@.6.............YNq.v[.k..........S......V..{.......
G..yD....q(.&.|.A.)".0%.7.%..e[V.#c..^S7F./.~.
13:50:13.272563 IP 192.168.0.65.59795 > varese-core-8c1f64aa609c.home.7878: Flags [.], ack 6790, win 2044, options [nop,nop,TS val 1897254018 ecr 1241212766], length 0
E..4..@.@..!...A...........LFt.5....$......
q...I.g^
13:50:13.273221 IP 192.168.0.65.59795 > varese-core-8c1f64aa609c.home.7878: Flags [P.], seq 7864:7951, ack 6790, win 2048, options [nop,nop,TS val 1897254018 ecr 1241212766], length 87
E.....@.@......A...........LFt.5....6......
q...I.g^....Rl....}.\.O..._~.nde..../>........8.......~.........o.h(."j. .Re['..........W..ws. 
13:50:13.322175 IP varese-core-8c1f64aa609c.home.7878 > 192.168.0.65.59795: Flags [.], ack 7951, win 1161, options [nop,nop,TS val 1241212813 ecr 1897254018], length 0
E..4.R@.@..........A....Ft.5........'......
I.g.q...
13:50:13.367727 IP 192.168.0.65.59795 > varese-core-8c1f64aa609c.home.7878: Flags [P.], seq 7951:7981, ack 6790, win 2048, options [nop,nop,TS val 1897254113 ecr 1241212813], length 30
E..R..@.@......A............Ft.5...........
q...I.g.........c0.4....?K.
.k.8._-.`.
13:50:13.367845 IP 192.168.0.65.59795 > varese-core-8c1f64aa609c.home.7878: Flags [P.], seq 7981:8164, ack 6790, win 2048, options [nop,nop,TS val 1897254113 ecr 1241212813], length 183
E.....@.@..h...A............Ft.5....C......
q...I.g.....'TC.....}hc....d.C.....<.,.._..+J....V.).v.:....p.t..Q.bK4.v...^........d1.....Zl...
l.A...r...3..c1.....3.h.A...9M.u...z#lP(..gzyhn....R..1-,....dy........E..z.."..N...+sbv3R....
13:50:13.367856 IP 192.168.0.65.59795 > varese-core-8c1f64aa609c.home.7878: Flags [P.], seq 8164:8281, ack 6790, win 2048, options [nop,nop,TS val 1897254113 ecr 1241212813], length 117
E.....@.@......A...........xFt.5...........
q...I.g....Q	....-.3.........gkG....1v>..Q...H....8......)S(k	K.DV.....}...a..@.r.[D..T...(G.(O...p....,.dg.[..l....".......
13:50:13.373471 IP varese-core-8c1f64aa609c.home.7878 > 192.168.0.65.59795: Flags [.], ack 8281, win 1161, options [nop,nop,TS val 1241212866 ecr 1897254113], length 0
E..4.S@.@..........A....Ft.5........%......
I.g.q...
13:50:13.384182 IP varese-core-8c1f64aa609c.home.7878 > 192.168.0.65.59795: Flags [P.], seq 6790:7000, ack 8281, win 1161, options [nop,nop,TS val 1241212876 ecr 1897254113], length 210
E....T@.@..........A....Ft.5........~......
I.g.q.........3l.1......1(..\...c......_.!.....X..T.Q}a..`.\P.....pw>Z..eu.E./_......7....6]V...9...-.bR..../c..$........M]..	.#..HHQ.2FKl;i...;.-..pr.`.......Q.(.L...A..?cm4..K.....=a&...f.>....d..3....B=...a..y0.....
13:50:13.384184 IP varese-core-8c1f64aa609c.home.7878 > 192.168.0.65.59795: Flags [P.], seq 7000:7267, ack 8281, win 1161, options [nop,nop,TS val 1241212877 ecr 1897254113], length 267
E..?.U@.@..........A....Ft..........[|.....
I.g.q.........U.|VS.......0
....C.9...e...V!d*....T.QJ..g.n...J.......}..M....^P./.Z.!M.U........<.S.X.:.."...'+.
;.../..w...vz.<`..........k..G5.f..;.......{<.t._...b.~.M*.'.(y;.#.>....O..#@.f>G^X...........A$..h....ae...f.f.........z...A...[).1-......UXgcf.%Gf.Nf0Q....VR.I
13:50:13.384299 IP 192.168.0.65.59795 > varese-core-8c1f64aa609c.home.7878: Flags [.], ack 7267, win 2041, options [nop,nop,TS val 1897254129 ecr 1241212877], length 0
E..4..@.@..!...A............Ft...... e.....
q...I.g.
13:50:13.385844 IP 192.168.0.65.59795 > varese-core-8c1f64aa609c.home.7878: Flags [P.], seq 8281:8368, ack 7267, win 2048, options [nop,nop,TS val 1897254131 ecr 1241212877], length 87
E.....@.@......A............Ft.............
q...I.g.....R..A$..J.~&..V.....#TiT.7@....p...x4.....L.'hR.C..^.b.i..1?.{.3..;8...>.c.9....."`.
13:50:13.431805 IP varese-core-8c1f64aa609c.home.7878 > 192.168.0.65.59795: Flags [.], ack 8368, win 1161, options [nop,nop,TS val 1241212925 ecr 1897254131], length 0
E..4.V@.@..........A....Ft.....D....#L.....
I.g.q...
13:50:16.730151 IP 192.168.0.65.59795 > varese-core-8c1f64aa609c.home.7878: Flags [P.], seq 8368:8396, ack 7267, win 2048, options [nop,nop,TS val 1897257475 ecr 1241212925], length 28
E..P..@.@......A...........DFt......s......
q...I.g............._..)$Z.&..s3..%.
13:50:16.734103 IP varese-core-8c1f64aa609c.home.7878 > 192.168.0.65.59795: Flags [.], ack 8396, win 1161, options [nop,nop,TS val 1241216227 ecr 1897257475], length 0
E..4.W@.@..........A....Ft.....`....	:.....
I.t.q...
13:50:16.734110 IP varese-core-8c1f64aa609c.home.7878 > 192.168.0.65.59795: Flags [P.], seq 7267:7291, ack 8396, win 1161, options [nop,nop,TS val 1241216228 ecr 1897257475], length 24
E..L.X@.@..........A....Ft.....`....h......
I.t.q........UrUl._....J..W..IJ.
13:50:16.734324 IP 192.168.0.65.59795 > varese-core-8c1f64aa609c.home.7878: Flags [.], ack 7291, win 2048, options [nop,nop,TS val 1897257480 ecr 1241216228], length 0
E..4..@.@..!...A...........`Ft.*...........
q...I.t.
13:50:17.342204 IP 192.168.0.65.59795 > varese-core-8c1f64aa609c.home.7878: Flags [.], ack 7291, win 2048, length 0
E..(....@.'....A..........._Ft.*P...H...
13:50:17.347101 IP varese-core-8c1f64aa609c.home.7878 > 192.168.0.65.59795: Flags [.], ack 8396, win 1161, options [nop,nop,TS val 1241216840 ecr 1897257480], length 0
E..4.Y@.@..........A....Ft.*...`...........
I.wHq...
13:50:21.737768 IP 192.168.0.65.59795 > varese-core-8c1f64aa609c.home.7878: Flags [P.], seq 8396:8424, ack 7291, win 2048, options [nop,nop,TS val 1897262483 ecr 1241216840], length 28
E..P..@.@......A...........`Ft.*...........
q...I.wH......*r.....Z..tg......p...
13:50:21.743229 IP varese-core-8c1f64aa609c.home.7878 > 192.168.0.65.59795: Flags [P.], seq 7291:7315, ack 8424, win 1161, options [nop,nop,TS val 1241221236 ecr 1897262483], length 24
E..L.Z@.@..........A....Ft.*...|...........
I..tq.........d...;....G1H.....y
13:50:21.743431 IP 192.168.0.65.59795 > varese-core-8c1f64aa609c.home.7878: Flags [.], ack 7315, win 2048, options [nop,nop,TS val 1897262489 ecr 1241221236], length 0
E..4..@.@..!...A...........|Ft.B.....O.....
q...I..t
13:50:21.949957 IP 192.168.0.65.59795 > varese-core-8c1f64aa609c.home.7878: Flags [.], ack 7315, win 2048, length 0
E..(*H..@......A...........{Ft.BP...H...
13:50:21.954715 IP varese-core-8c1f64aa609c.home.7878 > 192.168.0.65.59795: Flags [.], ack 8424, win 1161, options [nop,nop,TS val 1241221447 ecr 1897262489], length 0
E..4.[@.@..........A....Ft.B...|...........
I..Gq...
13:50:26.747255 IP 192.168.0.65.59795 > varese-core-8c1f64aa609c.home.7878: Flags [P.], seq 8424:8452, ack 7315, win 2048, options [nop,nop,TS val 1897267493 ecr 1241221447], length 28
E..P..@.@......A...........|Ft.B...........
q..%I..G.....}M+..u....`...5..S_.h".
13:50:26.755386 IP varese-core-8c1f64aa609c.home.7878 > 192.168.0.65.59795: Flags [P.], seq 7315:7339, ack 8452, win 1161, options [nop,nop,TS val 1241226248 ecr 1897267493], length 24
E..L.\@.@..........A....Ft.B.........v.....
I...q..%.....?fhR.......ZX...{..
13:50:26.755600 IP 192.168.0.65.59795 > varese-core-8c1f64aa609c.home.7878: Flags [.], ack 7339, win 2048, options [nop,nop,TS val 1897267501 ecr 1241226248], length 0
E..4..@.@..!...A............Ft.Z...........
q..-I...
13:50:26.965599 IP 192.168.0.65.59795 > varese-core-8c1f64aa609c.home.7878: Flags [.], ack 7339, win 2048, length 0
E..(....@.U....A............Ft.ZP...HS..
13:50:26.970974 IP varese-core-8c1f64aa609c.home.7878 > 192.168.0.65.59795: Flags [.], ack 8452, win 1161, options [nop,nop,TS val 1241226463 ecr 1897267501], length 0
E..4.]@.@..........A....Ft.Z...............
I...q..-
13:50:31.760271 IP 192.168.0.65.59795 > varese-core-8c1f64aa609c.home.7878: Flags [P.], seq 8452:8480, ack 7339, win 2048, options [nop,nop,TS val 1897272506 ecr 1241226463], length 28
E..P..@.@......A............Ft.Z....s......
q...I........+....!..~'...+.D....8&.
13:50:31.769857 IP varese-core-8c1f64aa609c.home.7878 > 192.168.0.65.59795: Flags [P.], seq 7339:7363, ack 8480, win 1161, options [nop,nop,TS val 1241231262 ecr 1897272506], length 24
E..L.^@.@..........A....Ft.Z........n......
I...q........|?.......CJE. ..#..
13:50:31.769944 IP 192.168.0.65.59795 > varese-core-8c1f64aa609c.home.7878: Flags [.], ack 7363, win 2048, options [nop,nop,TS val 1897272516 ecr 1241231262], length 0
E..4..@.@..!...A............Ft.r...........
q...I...
13:50:31.972659 IP 192.168.0.65.59795 > varese-core-8c1f64aa609c.home.7878: Flags [.], ack 7363, win 2048, length 0
E..(9...@..,...A............Ft.rP...H...
13:50:31.986296 IP varese-core-8c1f64aa609c.home.7878 > 192.168.0.65.59795: Flags [.], ack 8480, win 1161, options [nop,nop,TS val 1241231470 ecr 1897272516], length 0
E..4._@.@..........A....Ft.r.........9.....
I..nq...

