Last login: Fri Dec 12 13:43:09 on ttys002
zeki@Zekis-MacBook-Air ~ % sudo tcpdump -i en0 host 192.168.0.42 -A -s 0
Password:
tcpdump: verbose output suppressed, use -v[v]... for full protocol decode
listening on en0, link-type EN10MB (Ethernet), snapshot length 524288 bytes
13:45:06.632754 IP varese-interface-501e2d68ee7a.home.mdns > mdns.mcast.net.mdns: 0 PTR (QM)? _googlezone._tcp.local. (40)
E..D.@@...I....*.........0..............._googlezone._tcp.local.....
13:45:07.046514 IP varese-interface-501e2d68ee7a.home.mdns > mdns.mcast.net.mdns: 0 [2q] [3n] ANY (QM)? VarM-CM-(se-Core-ae04ea608ad930203aa073e6cadc29a2._googlecast._tcp.local. ANY (QM)? ae04ea60-8ad9-3020-3aa0-73e6cadc29a2.local. (349)
E..y.R@...HS...*.........e..............-Var..se-Core-ae04ea608ad930203aa073e6cadc29a2._googlecast._tcp.local.....$ae04ea60-8ad9-3020-3aa0-73e6cadc29a2.K................#id=ae04ea608ad930203aa073e6cadc29a2#cd=28AA0C4D4657250977621E58AD331DCF.rm=.ve=05.md=Var..se Core.ic=/setup/icon.png.fn=Living room	ca=199172.st=0.bs=FA8FCA6A0F32.nf=1.rs=...!.....x.......I.V.V.......x.....*
13:45:07.351421 IP varese-interface-501e2d68ee7a.home.mdns > mdns.mcast.net.mdns: 0 [2q] [3n] ANY (QM)? VarM-CM-(se-Core-ae04ea608ad930203aa073e6cadc29a2._googlecast._tcp.local. ANY (QM)? ae04ea60-8ad9-3020-3aa0-73e6cadc29a2.local. (349)
E..y..@...H....*.........e..............-Var..se-Core-ae04ea608ad930203aa073e6cadc29a2._googlecast._tcp.local.....$ae04ea60-8ad9-3020-3aa0-73e6cadc29a2.K................#id=ae04ea608ad930203aa073e6cadc29a2#cd=28AA0C4D4657250977621E58AD331DCF.rm=.ve=05.md=Var..se Core.ic=/setup/icon.png.fn=Living room	ca=199172.st=0.bs=FA8FCA6A0F32.nf=1.rs=...!.....x.......I.V.V.......x.....*
13:45:07.355043 IP varese-interface-501e2d68ee7a.home.mdns > mdns.mcast.net.mdns: 0 [2q] [3n] ANY (QM)? ae04ea60-8ad9-3020-3aa0-73e6cadc29a2._googlezone._tcp.local. ANY (QM)? ae04ea60-8ad9-3020-3aa0-73e6cadc29a2.local. (208)
E.....@...H....*........................$ae04ea60-8ad9-3020-3aa0-73e6cadc29a2._googlezone._tcp.local.....$ae04ea60-8ad9-3020-3aa0-73e6cadc29a2.B...............(#id=28AA0C4D4657250977621E58AD331DCF.CGS...!.....x......'..M.M.......x.....*
13:45:07.557013 IP varese-interface-501e2d68ee7a.home.mdns > mdns.mcast.net.mdns: 0 [2q] [3n] ANY (QM)? VarM-CM-(se-Core-ae04ea608ad930203aa073e6cadc29a2._googlecast._tcp.local. ANY (QM)? ae04ea60-8ad9-3020-3aa0-73e6cadc29a2.local. (349)
E..y..@...H....*.........e..............-Var..se-Core-ae04ea608ad930203aa073e6cadc29a2._googlecast._tcp.local.....$ae04ea60-8ad9-3020-3aa0-73e6cadc29a2.K................#id=ae04ea608ad930203aa073e6cadc29a2#cd=28AA0C4D4657250977621E58AD331DCF.rm=.ve=05.md=Var..se Core.ic=/setup/icon.png.fn=Living room	ca=199172.st=0.bs=FA8FCA6A0F32.nf=1.rs=...!.....x.......I.V.V.......x.....*
13:45:07.563607 IP varese-interface-501e2d68ee7a.home.mdns > mdns.mcast.net.mdns: 0 [2q] [3n] ANY (QM)? ae04ea60-8ad9-3020-3aa0-73e6cadc29a2._googlezone._tcp.local. ANY (QM)? ae04ea60-8ad9-3020-3aa0-73e6cadc29a2.local. (208)
E.....@...H....*........................$ae04ea60-8ad9-3020-3aa0-73e6cadc29a2._googlezone._tcp.local.....$ae04ea60-8ad9-3020-3aa0-73e6cadc29a2.B...............(#id=28AA0C4D4657250977621E58AD331DCF.CGS...!.....x......'..M.M.......x.....*
13:45:08.789687 IP varese-interface-501e2d68ee7a.home.mdns > mdns.mcast.net.mdns: 0*- [0q] 4/0/0 PTR VarM-CM-(se-Core-ae04ea608ad930203aa073e6cadc29a2._googlecast._tcp.local., (Cache flush) TXT "id=ae04ea608ad930203aa073e6cadc29a2" "cd=28AA0C4D4657250977621E58AD331DCF" "rm=" "ve=05" "md=VarM-CM-(se Core" "ic=/setup/icon.png" "fn=Living room" "ca=199172" "st=0" "bs=FA8FCA6A0F32" "nf=1" "rs=", (Cache flush) SRV ae04ea60-8ad9-3020-3aa0-73e6cadc29a2.local.:8009 0 0, (Cache flush) A 192.168.0.42 (351)
E..{..@...G....*.........g..............._googlecast._tcp.local........x.0-Var..se-Core-ae04ea608ad930203aa073e6cadc29a2..............#id=ae04ea608ad930203aa073e6cadc29a2#cd=28AA0C4D4657250977621E58AD331DCF.rm=.ve=05.md=Var..se Core.ic=/setup/icon.png.fn=Living room	ca=199172.st=0.bs=FA8FCA6A0F32.nf=1.rs=...!.....x.-.....I$ae04ea60-8ad9-3020-3aa0-73e6cadc29a2...(.......x.....*
13:45:08.795251 IP varese-interface-501e2d68ee7a.home.mdns > mdns.mcast.net.mdns: 0*- [0q] 4/0/0 PTR ae04ea60-8ad9-3020-3aa0-73e6cadc29a2._googlezone._tcp.local., (Cache flush) TXT "id=28AA0C4D4657250977621E58AD331DCF" "CGS", (Cache flush) SRV ae04ea60-8ad9-3020-3aa0-73e6cadc29a2.local.:10001 700 0, (Cache flush) A 192.168.0.42 (210)
E.....@...H!...*...........?............._googlezone._tcp.local........x.'$ae04ea60-8ad9-3020-3aa0-73e6cadc29a2.............(#id=28AA0C4D4657250977621E58AD331DCF.CGS...!.....x.-....'.$ae04ea60-8ad9-3020-3aa0-73e6cadc29a2...........x.....*
13:45:10.018379 IP varese-interface-501e2d68ee7a.home.mdns > mdns.mcast.net.mdns: 0 [2q] [3n] ANY (QM)? VarM-CM-(se-Core-ae04ea608ad930203aa073e6cadc29a2._googlecast._tcp.local. ANY (QM)? ae04ea60-8ad9-3020-3aa0-73e6cadc29a2.local. (349)
E..y..@...F....*.........e..............-Var..se-Core-ae04ea608ad930203aa073e6cadc29a2._googlecast._tcp.local.....$ae04ea60-8ad9-3020-3aa0-73e6cadc29a2.K................#id=ae04ea608ad930203aa073e6cadc29a2#cd=28AA0C4D4657250977621E58AD331DCF.rm=.ve=05.md=Var..se Core.ic=/setup/icon.png.fn=Living room	ca=199172.st=0.bs=FA8FCA6A0F32.nf=1.rs=...!.....x.......I.V.V.......x.....*
13:45:10.023918 IP varese-interface-501e2d68ee7a.home.mdns > mdns.mcast.net.mdns: 0 [2q] [3n] ANY (QM)? ae04ea60-8ad9-3020-3aa0-73e6cadc29a2._googlezone._tcp.local. ANY (QM)? ae04ea60-8ad9-3020-3aa0-73e6cadc29a2.local. (208)
E.....@...Gs...*........................$ae04ea60-8ad9-3020-3aa0-73e6cadc29a2._googlezone._tcp.local.....$ae04ea60-8ad9-3020-3aa0-73e6cadc29a2.B...............(#id=28AA0C4D4657250977621E58AD331DCF.CGS...!.....x......'..M.M.......x.....*
13:45:10.323499 IP varese-interface-501e2d68ee7a.home.mdns > mdns.mcast.net.mdns: 0 [2q] [3n] ANY (QM)? VarM-CM-(se-Core-ae04ea608ad930203aa073e6cadc29a2._googlecast._tcp.local. ANY (QM)? ae04ea60-8ad9-3020-3aa0-73e6cadc29a2.local. (349)
E..y..@...F....*.........e..............-Var..se-Core-ae04ea608ad930203aa073e6cadc29a2._googlecast._tcp.local.....$ae04ea60-8ad9-3020-3aa0-73e6cadc29a2.K................#id=ae04ea608ad930203aa073e6cadc29a2#cd=28AA0C4D4657250977621E58AD331DCF.rm=.ve=05.md=Var..se Core.ic=/setup/icon.png.fn=Living room	ca=199172.st=0.bs=FA8FCA6A0F32.nf=1.rs=...!.....x.......I.V.V.......x.....*
13:45:10.330137 IP varese-interface-501e2d68ee7a.home.mdns > mdns.mcast.net.mdns: 0 [2q] [3n] ANY (QM)? ae04ea60-8ad9-3020-3aa0-73e6cadc29a2._googlezone._tcp.local. ANY (QM)? ae04ea60-8ad9-3020-3aa0-73e6cadc29a2.local. (208)
E.....@...Gg...*........................$ae04ea60-8ad9-3020-3aa0-73e6cadc29a2._googlezone._tcp.local.....$ae04ea60-8ad9-3020-3aa0-73e6cadc29a2.B...............(#id=28AA0C4D4657250977621E58AD331DCF.CGS...!.....x......'..M.M.......x.....*
13:45:10.530460 IP varese-interface-501e2d68ee7a.home.mdns > mdns.mcast.net.mdns: 0 [2q] [3n] ANY (QM)? VarM-CM-(se-Core-ae04ea608ad930203aa073e6cadc29a2._googlecast._tcp.local. ANY (QM)? ae04ea60-8ad9-3020-3aa0-73e6cadc29a2.local. (349)
E..y..@...F....*.........e..............-Var..se-Core-ae04ea608ad930203aa073e6cadc29a2._googlecast._tcp.local.....$ae04ea60-8ad9-3020-3aa0-73e6cadc29a2.K................#id=ae04ea608ad930203aa073e6cadc29a2#cd=28AA0C4D4657250977621E58AD331DCF.rm=.ve=05.md=Var..se Core.ic=/setup/icon.png.fn=Living room	ca=199172.st=0.bs=FA8FCA6A0F32.nf=1.rs=...!.....x.......I.V.V.......x.....*
13:45:10.535897 IP varese-interface-501e2d68ee7a.home.mdns > mdns.mcast.net.mdns: 0 [2q] [3n] ANY (QM)? ae04ea60-8ad9-3020-3aa0-73e6cadc29a2._googlezone._tcp.local. ANY (QM)? ae04ea60-8ad9-3020-3aa0-73e6cadc29a2.local. (208)
E.....@...GW...*........................$ae04ea60-8ad9-3020-3aa0-73e6cadc29a2._googlezone._tcp.local.....$ae04ea60-8ad9-3020-3aa0-73e6cadc29a2.B...............(#id=28AA0C4D4657250977621E58AD331DCF.CGS...!.....x......'..M.M.......x.....*
13:45:11.759441 IP varese-interface-501e2d68ee7a.home.mdns > mdns.mcast.net.mdns: 0*- [0q] 4/0/0 PTR VarM-CM-(se-Core-ae04ea608ad930203aa073e6cadc29a2._googlecast._tcp.local., (Cache flush) TXT "id=ae04ea608ad930203aa073e6cadc29a2" "cd=28AA0C4D4657250977621E58AD331DCF" "rm=" "ve=05" "md=VarM-CM-(se Core" "ic=/setup/icon.png" "fn=Living room" "ca=199172" "st=0" "bs=FA8FCA6A0F32" "nf=1" "rs=", (Cache flush) SRV ae04ea60-8ad9-3020-3aa0-73e6cadc29a2.local.:8009 0 0, (Cache flush) A 192.168.0.42 (351)
E..{..@...F....*.........g..............._googlecast._tcp.local........x.0-Var..se-Core-ae04ea608ad930203aa073e6cadc29a2..............#id=ae04ea608ad930203aa073e6cadc29a2#cd=28AA0C4D4657250977621E58AD331DCF.rm=.ve=05.md=Var..se Core.ic=/setup/icon.png.fn=Living room	ca=199172.st=0.bs=FA8FCA6A0F32.nf=1.rs=...!.....x.-.....I$ae04ea60-8ad9-3020-3aa0-73e6cadc29a2...(.......x.....*
13:45:11.764798 IP varese-interface-501e2d68ee7a.home.mdns > mdns.mcast.net.mdns: 0*- [0q] 4/0/0 PTR ae04ea60-8ad9-3020-3aa0-73e6cadc29a2._googlezone._tcp.local., (Cache flush) TXT "id=28AA0C4D4657250977621E58AD331DCF" "CGS", (Cache flush) SRV ae04ea60-8ad9-3020-3aa0-73e6cadc29a2.local.:10001 700 0, (Cache flush) A 192.168.0.42 (210)
E.....@...F....*...........?............._googlezone._tcp.local........x.'$ae04ea60-8ad9-3020-3aa0-73e6cadc29a2.............(#id=28AA0C4D4657250977621E58AD331DCF.CGS...!.....x.-....'.$ae04ea60-8ad9-3020-3aa0-73e6cadc29a2...........x.....*
13:45:12.984101 IP varese-interface-501e2d68ee7a.home.mdns > mdns.mcast.net.mdns: 0 [2q] [3n] ANY (QM)? VarM-CM-(se-Core-ae04ea608ad930203aa073e6cadc29a2._googlecast._tcp.local. ANY (QM)? ae04ea60-8ad9-3020-3aa0-73e6cadc29a2.local. (349)
E..y.5@...Ep...*.........e..............-Var..se-Core-ae04ea608ad930203aa073e6cadc29a2._googlecast._tcp.local.....$ae04ea60-8ad9-3020-3aa0-73e6cadc29a2.K................#id=ae04ea608ad930203aa073e6cadc29a2#cd=28AA0C4D4657250977621E58AD331DCF.rm=.ve=05.md=Var..se Core.ic=/setup/icon.png.fn=Living room	ca=199172.st=0.bs=FA8FCA6A0F32.nf=1.rs=...!.....x.......I.V.V.......x.....*
13:45:12.991084 IP varese-interface-501e2d68ee7a.home.mdns > mdns.mcast.net.mdns: 0 [2q] [3n] ANY (QM)? ae04ea60-8ad9-3020-3aa0-73e6cadc29a2._googlezone._tcp.local. ANY (QM)? ae04ea60-8ad9-3020-3aa0-73e6cadc29a2.local. (208)
E....6@...E....*........................$ae04ea60-8ad9-3020-3aa0-73e6cadc29a2._googlezone._tcp.local.....$ae04ea60-8ad9-3020-3aa0-73e6cadc29a2.B...............(#id=28AA0C4D4657250977621E58AD331DCF.CGS...!.....x......'..M.M.......x.....*
13:45:13.193697 IP varese-interface-501e2d68ee7a.home.mdns > mdns.mcast.net.mdns: 0 [2q] [3n] ANY (QM)? VarM-CM-(se-Core-ae04ea608ad930203aa073e6cadc29a2._googlecast._tcp.local. ANY (QM)? ae04ea60-8ad9-3020-3aa0-73e6cadc29a2.local. (349)
E..y.Y@...EL...*.........e..............-Var..se-Core-ae04ea608ad930203aa073e6cadc29a2._googlecast._tcp.local.....$ae04ea60-8ad9-3020-3aa0-73e6cadc29a2.K................#id=ae04ea608ad930203aa073e6cadc29a2#cd=28AA0C4D4657250977621E58AD331DCF.rm=.ve=05.md=Var..se Core.ic=/setup/icon.png.fn=Living room	ca=199172.st=0.bs=FA8FCA6A0F32.nf=1.rs=...!.....x.......I.V.V.......x.....*
13:45:13.199403 IP varese-interface-501e2d68ee7a.home.mdns > mdns.mcast.net.mdns: 0 [2q] [3n] ANY (QM)? ae04ea60-8ad9-3020-3aa0-73e6cadc29a2._googlezone._tcp.local. ANY (QM)? ae04ea60-8ad9-3020-3aa0-73e6cadc29a2.local. (208)
E....Z@...E....*........................$ae04ea60-8ad9-3020-3aa0-73e6cadc29a2._googlezone._tcp.local.....$ae04ea60-8ad9-3020-3aa0-73e6cadc29a2.B...............(#id=28AA0C4D4657250977621E58AD331DCF.CGS...!.....x......'..M.M.......x.....*
13:45:13.496284 IP varese-interface-501e2d68ee7a.home.mdns > mdns.mcast.net.mdns: 0 [2q] [3n] ANY (QM)? VarM-CM-(se-Core-ae04ea608ad930203aa073e6cadc29a2._googlecast._tcp.local. ANY (QM)? ae04ea60-8ad9-3020-3aa0-73e6cadc29a2.local. (349)
E..y.p@...E5...*.........e..............-Var..se-Core-ae04ea608ad930203aa073e6cadc29a2._googlecast._tcp.local.....$ae04ea60-8ad9-3020-3aa0-73e6cadc29a2.K................#id=ae04ea608ad930203aa073e6cadc29a2#cd=28AA0C4D4657250977621E58AD331DCF.rm=.ve=05.md=Var..se Core.ic=/setup/icon.png.fn=Living room	ca=199172.st=0.bs=FA8FCA6A0F32.nf=1.rs=...!.....x.......I.V.V.......x.....*
13:45:13.509453 IP varese-interface-501e2d68ee7a.home.mdns > mdns.mcast.net.mdns: 0 [2q] [3n] ANY (QM)? ae04ea60-8ad9-3020-3aa0-73e6cadc29a2._googlezone._tcp.local. ANY (QM)? ae04ea60-8ad9-3020-3aa0-73e6cadc29a2.local. (208)
E....q@...E....*........................$ae04ea60-8ad9-3020-3aa0-73e6cadc29a2._googlezone._tcp.local.....$ae04ea60-8ad9-3020-3aa0-73e6cadc29a2.B...............(#id=28AA0C4D4657250977621E58AD331DCF.CGS...!.....x......'..M.M.......x.....*
13:45:14.732938 IP varese-interface-501e2d68ee7a.home.mdns > mdns.mcast.net.mdns: 0*- [0q] 4/0/0 PTR VarM-CM-(se-Core-ae04ea608ad930203aa073e6cadc29a2._googlecast._tcp.local., (Cache flush) TXT "id=ae04ea608ad930203aa073e6cadc29a2" "cd=28AA0C4D4657250977621E58AD331DCF" "rm=" "ve=05" "md=VarM-CM-(se Core" "ic=/setup/icon.png" "fn=Living room" "ca=199172" "st=0" "bs=FA8FCA6A0F32" "nf=1" "rs=", (Cache flush) SRV ae04ea60-8ad9-3020-3aa0-73e6cadc29a2.local.:8009 0 0, (Cache flush) A 192.168.0.42 (351)
E..{..@...D....*.........g..............._googlecast._tcp.local........x.0-Var..se-Core-ae04ea608ad930203aa073e6cadc29a2..............#id=ae04ea608ad930203aa073e6cadc29a2#cd=28AA0C4D4657250977621E58AD331DCF.rm=.ve=05.md=Var..se Core.ic=/setup/icon.png.fn=Living room	ca=199172.st=0.bs=FA8FCA6A0F32.nf=1.rs=...!.....x.-.....I$ae04ea60-8ad9-3020-3aa0-73e6cadc29a2...(.......x.....*
13:45:14.742340 IP varese-interface-501e2d68ee7a.home.mdns > mdns.mcast.net.mdns: 0*- [0q] 4/0/0 PTR ae04ea60-8ad9-3020-3aa0-73e6cadc29a2._googlezone._tcp.local., (Cache flush) TXT "id=28AA0C4D4657250977621E58AD331DCF" "CGS", (Cache flush) SRV ae04ea60-8ad9-3020-3aa0-73e6cadc29a2.local.:10001 700 0, (Cache flush) A 192.168.0.42 (210)
E.....@...EX...*...........?............._googlezone._tcp.local........x.'$ae04ea60-8ad9-3020-3aa0-73e6cadc29a2.............(#id=28AA0C4D4657250977621E58AD331DCF.CGS...!.....x.-....'.$ae04ea60-8ad9-3020-3aa0-73e6cadc29a2...........x.....*
13:45:15.854471 IP varese-interface-501e2d68ee7a.home.mdns > mdns.mcast.net.mdns: 0 [2q] [3n] ANY (QM)? VarM-CM-(se-Core-ae04ea608ad930203aa073e6cadc29a2._googlecast._tcp.local. ANY (QM)? ae04ea60-8ad9-3020-3aa0-73e6cadc29a2.local. (349)
E..y..@...C....*.........e..............-Var..se-Core-ae04ea608ad930203aa073e6cadc29a2._googlecast._tcp.local.....$ae04ea60-8ad9-3020-3aa0-73e6cadc29a2.K................#id=ae04ea608ad930203aa073e6cadc29a2#cd=28AA0C4D4657250977621E58AD331DCF.rm=.ve=05.md=Var..se Core.ic=/setup/icon.png.fn=Living room	ca=199172.st=0.bs=FA8FCA6A0F32.nf=1.rs=...!.....x.......I.V.V.......x.....*
13:45:15.860169 IP varese-interface-501e2d68ee7a.home.mdns > mdns.mcast.net.mdns: 0 [2q] [3n] ANY (QM)? ae04ea60-8ad9-3020-3aa0-73e6cadc29a2._googlezone._tcp.local. ANY (QM)? ae04ea60-8ad9-3020-3aa0-73e6cadc29a2.local. (208)
E.....@...DS...*........................$ae04ea60-8ad9-3020-3aa0-73e6cadc29a2._googlezone._tcp.local.....$ae04ea60-8ad9-3020-3aa0-73e6cadc29a2.B...............(#id=28AA0C4D4657250977621E58AD331DCF.CGS...!.....x......'..M.M.......x.....*
13:45:16.061263 IP varese-interface-501e2d68ee7a.home.mdns > mdns.mcast.net.mdns: 0 [2q] [3n] ANY (QM)? VarM-CM-(se-Core-ae04ea608ad930203aa073e6cadc29a2._googlecast._tcp.local. ANY (QM)? ae04ea60-8ad9-3020-3aa0-73e6cadc29a2.local. (349)
E..y..@...C....*.........e..............-Var..se-Core-ae04ea608ad930203aa073e6cadc29a2._googlecast._tcp.local.....$ae04ea60-8ad9-3020-3aa0-73e6cadc29a2.K................#id=ae04ea608ad930203aa073e6cadc29a2#cd=28AA0C4D4657250977621E58AD331DCF.rm=.ve=05.md=Var..se Core.ic=/setup/icon.png.fn=Living room	ca=199172.st=0.bs=FA8FCA6A0F32.nf=1.rs=...!.....x.......I.V.V.......x.....*
13:45:16.066908 IP varese-interface-501e2d68ee7a.home.mdns > mdns.mcast.net.mdns: 0 [2q] [3n] ANY (QM)? ae04ea60-8ad9-3020-3aa0-73e6cadc29a2._googlezone._tcp.local. ANY (QM)? ae04ea60-8ad9-3020-3aa0-73e6cadc29a2.local. (208)
E.....@...D....*........................$ae04ea60-8ad9-3020-3aa0-73e6cadc29a2._googlezone._tcp.local.....$ae04ea60-8ad9-3020-3aa0-73e6cadc29a2.B...............(#id=28AA0C4D4657250977621E58AD331DCF.CGS...!.....x......'..M.M.......x.....*
13:45:16.367249 IP varese-interface-501e2d68ee7a.home.mdns > mdns.mcast.net.mdns: 0 [2q] [3n] ANY (QM)? VarM-CM-(se-Core-ae04ea608ad930203aa073e6cadc29a2._googlecast._tcp.local. ANY (QM)? ae04ea60-8ad9-3020-3aa0-73e6cadc29a2.local. (349)
E..y.&@...C....*.........e..............-Var..se-Core-ae04ea608ad930203aa073e6cadc29a2._googlecast._tcp.local.....$ae04ea60-8ad9-3020-3aa0-73e6cadc29a2.K................#id=ae04ea608ad930203aa073e6cadc29a2#cd=28AA0C4D4657250977621E58AD331DCF.rm=.ve=05.md=Var..se Core.ic=/setup/icon.png.fn=Living room	ca=199172.st=0.bs=FA8FCA6A0F32.nf=1.rs=...!.....x.......I.V.V.......x.....*
13:45:16.373855 IP varese-interface-501e2d68ee7a.home.mdns > mdns.mcast.net.mdns: 0 [2q] [3n] ANY (QM)? ae04ea60-8ad9-3020-3aa0-73e6cadc29a2._googlezone._tcp.local. ANY (QM)? ae04ea60-8ad9-3020-3aa0-73e6cadc29a2.local. (208)
E....'@...D....*........................$ae04ea60-8ad9-3020-3aa0-73e6cadc29a2._googlezone._tcp.local.....$ae04ea60-8ad9-3020-3aa0-73e6cadc29a2.B...............(#id=28AA0C4D4657250977621E58AD331DCF.CGS...!.....x......'..M.M.......x.....*
13:45:17.597371 IP varese-interface-501e2d68ee7a.home.mdns > mdns.mcast.net.mdns: 0*- [0q] 4/0/0 PTR VarM-CM-(se-Core-ae04ea608ad930203aa073e6cadc29a2._googlecast._tcp.local., (Cache flush) TXT "id=ae04ea608ad930203aa073e6cadc29a2" "cd=28AA0C4D4657250977621E58AD331DCF" "rm=" "ve=05" "md=VarM-CM-(se Core" "ic=/setup/icon.png" "fn=Living room" "ca=199172" "st=0" "bs=FA8FCA6A0F32" "nf=1" "rs=", (Cache flush) SRV ae04ea60-8ad9-3020-3aa0-73e6cadc29a2.local.:8009 0 0, (Cache flush) A 192.168.0.42 (351)
E..{..@...B....*.........g..............._googlecast._tcp.local........x.0-Var..se-Core-ae04ea608ad930203aa073e6cadc29a2..............#id=ae04ea608ad930203aa073e6cadc29a2#cd=28AA0C4D4657250977621E58AD331DCF.rm=.ve=05.md=Var..se Core.ic=/setup/icon.png.fn=Living room	ca=199172.st=0.bs=FA8FCA6A0F32.nf=1.rs=...!.....x.-.....I$ae04ea60-8ad9-3020-3aa0-73e6cadc29a2...(.......x.....*
13:45:17.602918 IP varese-interface-501e2d68ee7a.home.mdns > mdns.mcast.net.mdns: 0*- [0q] 4/0/0 PTR ae04ea60-8ad9-3020-3aa0-73e6cadc29a2._googlezone._tcp.local., (Cache flush) TXT "id=28AA0C4D4657250977621E58AD331DCF" "CGS", (Cache flush) SRV ae04ea60-8ad9-3020-3aa0-73e6cadc29a2.local.:10001 700 0, (Cache flush) A 192.168.0.42 (210)
E.....@...C....*...........?............._googlezone._tcp.local........x.'$ae04ea60-8ad9-3020-3aa0-73e6cadc29a2.............(#id=28AA0C4D4657250977621E58AD331DCF.CGS...!.....x.-....'.$ae04ea60-8ad9-3020-3aa0-73e6cadc29a2...........x.....*
13:45:18.616150 IP varese-interface-501e2d68ee7a.home.mdns > mdns.mcast.net.mdns: 0 [2q] [3n] ANY (QM)? VarM-CM-(se-Core-ae04ea608ad930203aa073e6cadc29a2._googlecast._tcp.local. ANY (QM)? ae04ea60-8ad9-3020-3aa0-73e6cadc29a2.local. (349)
E..y.t@...B1...*.........e..............-Var..se-Core-ae04ea608ad930203aa073e6cadc29a2._googlecast._tcp.local.....$ae04ea60-8ad9-3020-3aa0-73e6cadc29a2.K................#id=ae04ea608ad930203aa073e6cadc29a2#cd=28AA0C4D4657250977621E58AD331DCF.rm=.ve=05.md=Var..se Core.ic=/setup/icon.png.fn=Living room	ca=199172.st=0.bs=FA8FCA6A0F32.nf=1.rs=...!.....x.......I.V.V.......x.....*
13:45:18.621891 IP varese-interface-501e2d68ee7a.home.mdns > mdns.mcast.net.mdns: 0 [2q] [3n] ANY (QM)? ae04ea60-8ad9-3020-3aa0-73e6cadc29a2._googlezone._tcp.local. ANY (QM)? ae04ea60-8ad9-3020-3aa0-73e6cadc29a2.local. (208)
E....u@...B....*........................$ae04ea60-8ad9-3020-3aa0-73e6cadc29a2._googlezone._tcp.local.....$ae04ea60-8ad9-3020-3aa0-73e6cadc29a2.B...............(#id=28AA0C4D4657250977621E58AD331DCF.CGS...!.....x......'..M.M.......x.....*
13:45:18.927789 IP varese-interface-501e2d68ee7a.home.mdns > mdns.mcast.net.mdns: 0 [2q] [3n] ANY (QM)? VarM-CM-(se-Core-ae04ea608ad930203aa073e6cadc29a2._googlecast._tcp.local. ANY (QM)? ae04ea60-8ad9-3020-3aa0-73e6cadc29a2.local. (349)
E..y..@...B....*.........e..............-Var..se-Core-ae04ea608ad930203aa073e6cadc29a2._googlecast._tcp.local.....$ae04ea60-8ad9-3020-3aa0-73e6cadc29a2.K................#id=ae04ea608ad930203aa073e6cadc29a2#cd=28AA0C4D4657250977621E58AD331DCF.rm=.ve=05.md=Var..se Core.ic=/setup/icon.png.fn=Living room	ca=199172.st=0.bs=FA8FCA6A0F32.nf=1.rs=...!.....x.......I.V.V.......x.....*
13:45:18.930292 IP varese-interface-501e2d68ee7a.home.mdns > mdns.mcast.net.mdns: 0 [2q] [3n] ANY (QM)? ae04ea60-8ad9-3020-3aa0-73e6cadc29a2._googlezone._tcp.local. ANY (QM)? ae04ea60-8ad9-3020-3aa0-73e6cadc29a2.local. (208)
E.....@...B....*........................$ae04ea60-8ad9-3020-3aa0-73e6cadc29a2._googlezone._tcp.local.....$ae04ea60-8ad9-3020-3aa0-73e6cadc29a2.B...............(#id=28AA0C4D4657250977621E58AD331DCF.CGS...!.....x......'..M.M.......x.....*
13:45:19.128185 IP varese-interface-501e2d68ee7a.home.mdns > mdns.mcast.net.mdns: 0 [2q] [3n] ANY (QM)? VarM-CM-(se-Core-ae04ea608ad930203aa073e6cadc29a2._googlecast._tcp.local. ANY (QM)? ae04ea60-8ad9-3020-3aa0-73e6cadc29a2.local. (349)
E..y..@...A....*.........e..............-Var..se-Core-ae04ea608ad930203aa073e6cadc29a2._googlecast._tcp.local.....$ae04ea60-8ad9-3020-3aa0-73e6cadc29a2.K................#id=ae04ea608ad930203aa073e6cadc29a2#cd=28AA0C4D4657250977621E58AD331DCF.rm=.ve=05.md=Var..se Core.ic=/setup/icon.png.fn=Living room	ca=199172.st=0.bs=FA8FCA6A0F32.nf=1.rs=...!.....x.......I.V.V.......x.....*
13:45:19.137588 IP varese-interface-501e2d68ee7a.home.mdns > mdns.mcast.net.mdns: 0 [2q] [3n] ANY (QM)? ae04ea60-8ad9-3020-3aa0-73e6cadc29a2._googlezone._tcp.local. ANY (QM)? ae04ea60-8ad9-3020-3aa0-73e6cadc29a2.local. (208)
E.....@...B....*........................$ae04ea60-8ad9-3020-3aa0-73e6cadc29a2._googlezone._tcp.local.....$ae04ea60-8ad9-3020-3aa0-73e6cadc29a2.B...............(#id=28AA0C4D4657250977621E58AD331DCF.CGS...!.....x......'..M.M.......x.....*
13:45:20.461287 IP varese-interface-501e2d68ee7a.home.mdns > mdns.mcast.net.mdns: 0*- [0q] 4/0/0 PTR VarM-CM-(se-Core-ae04ea608ad930203aa073e6cadc29a2._googlecast._tcp.local., (Cache flush) TXT "id=ae04ea608ad930203aa073e6cadc29a2" "cd=28AA0C4D4657250977621E58AD331DCF" "rm=" "ve=05" "md=VarM-CM-(se Core" "ic=/setup/icon.png" "fn=Living room" "ca=199172" "st=0" "bs=FA8FCA6A0F32" "nf=1" "rs=", (Cache flush) SRV ae04ea60-8ad9-3020-3aa0-73e6cadc29a2.local.:8009 0 0, (Cache flush) A 192.168.0.42 (351)
E..{..@...A....*.........g..............._googlecast._tcp.local........x.0-Var..se-Core-ae04ea608ad930203aa073e6cadc29a2..............#id=ae04ea608ad930203aa073e6cadc29a2#cd=28AA0C4D4657250977621E58AD331DCF.rm=.ve=05.md=Var..se Core.ic=/setup/icon.png.fn=Living room	ca=199172.st=0.bs=FA8FCA6A0F32.nf=1.rs=...!.....x.-.....I$ae04ea60-8ad9-3020-3aa0-73e6cadc29a2...(.......x.....*
13:45:20.470580 IP varese-interface-501e2d68ee7a.home.mdns > mdns.mcast.net.mdns: 0*- [0q] 4/0/0 PTR ae04ea60-8ad9-3020-3aa0-73e6cadc29a2._googlezone._tcp.local., (Cache flush) TXT "id=28AA0C4D4657250977621E58AD331DCF" "CGS", (Cache flush) SRV ae04ea60-8ad9-3020-3aa0-73e6cadc29a2.local.:10001 700 0, (Cache flush) A 192.168.0.42 (210)
E.....@...BU...*...........?............._googlezone._tcp.local........x.'$ae04ea60-8ad9-3020-3aa0-73e6cadc29a2.............(#id=28AA0C4D4657250977621E58AD331DCF.CGS...!.....x.-....'.$ae04ea60-8ad9-3020-3aa0-73e6cadc29a2...........x.....*
13:45:21.483434 IP varese-interface-501e2d68ee7a.home.mdns > mdns.mcast.net.mdns: 0 [2q] [3n] ANY (QM)? VarM-CM-(se-Core-ae04ea608ad930203aa073e6cadc29a2._googlecast._tcp.local. ANY (QM)? ae04ea60-8ad9-3020-3aa0-73e6cadc29a2.local. (349)
E..y..@...A....*.........e..............-Var..se-Core-ae04ea608ad930203aa073e6cadc29a2._googlecast._tcp.local.....$ae04ea60-8ad9-3020-3aa0-73e6cadc29a2.K................#id=ae04ea608ad930203aa073e6cadc29a2#cd=28AA0C4D4657250977621E58AD331DCF.rm=.ve=05.md=Var..se Core.ic=/setup/icon.png.fn=Living room	ca=199172.st=0.bs=FA8FCA6A0F32.nf=1.rs=...!.....x.......I.V.V.......x.....*
13:45:21.492904 IP varese-interface-501e2d68ee7a.home.mdns > mdns.mcast.net.mdns: 0 [2q] [3n] ANY (QM)? ae04ea60-8ad9-3020-3aa0-73e6cadc29a2._googlezone._tcp.local. ANY (QM)? ae04ea60-8ad9-3020-3aa0-73e6cadc29a2.local. (208)
E.....@...B....*........................$ae04ea60-8ad9-3020-3aa0-73e6cadc29a2._googlezone._tcp.local.....$ae04ea60-8ad9-3020-3aa0-73e6cadc29a2.B...............(#id=28AA0C4D4657250977621E58AD331DCF.CGS...!.....x......'..M.M.......x.....*
13:45:21.688244 IP varese-interface-501e2d68ee7a.home.mdns > mdns.mcast.net.mdns: 0 [2q] [3n] ANY (QM)? VarM-CM-(se-Core-ae04ea608ad930203aa073e6cadc29a2._googlecast._tcp.local. ANY (QM)? ae04ea60-8ad9-3020-3aa0-73e6cadc29a2.local. (349)
E..y.6@...Ao...*.........e..............-Var..se-Core-ae04ea608ad930203aa073e6cadc29a2._googlecast._tcp.local.....$ae04ea60-8ad9-3020-3aa0-73e6cadc29a2.K................#id=ae04ea608ad930203aa073e6cadc29a2#cd=28AA0C4D4657250977621E58AD331DCF.rm=.ve=05.md=Var..se Core.ic=/setup/icon.png.fn=Living room	ca=199172.st=0.bs=FA8FCA6A0F32.nf=1.rs=...!.....x.......I.V.V.......x.....*
13:45:21.697938 IP varese-interface-501e2d68ee7a.home.mdns > mdns.mcast.net.mdns: 0 [2q] [3n] ANY (QM)? ae04ea60-8ad9-3020-3aa0-73e6cadc29a2._googlezone._tcp.local. ANY (QM)? ae04ea60-8ad9-3020-3aa0-73e6cadc29a2.local. (208)
E....7@...A....*........................$ae04ea60-8ad9-3020-3aa0-73e6cadc29a2._googlezone._tcp.local.....$ae04ea60-8ad9-3020-3aa0-73e6cadc29a2.B...............(#id=28AA0C4D4657250977621E58AD331DCF.CGS...!.....x......'..M.M.......x.....*
13:45:21.999288 IP varese-interface-501e2d68ee7a.home.mdns > mdns.mcast.net.mdns: 0 [2q] [3n] ANY (QM)? VarM-CM-(se-Core-ae04ea608ad930203aa073e6cadc29a2._googlecast._tcp.local. ANY (QM)? ae04ea60-8ad9-3020-3aa0-73e6cadc29a2.local. (349)
E..y.i@...A<...*.........e..............-Var..se-Core-ae04ea608ad930203aa073e6cadc29a2._googlecast._tcp.local.....$ae04ea60-8ad9-3020-3aa0-73e6cadc29a2.K................#id=ae04ea608ad930203aa073e6cadc29a2#cd=28AA0C4D4657250977621E58AD331DCF.rm=.ve=05.md=Var..se Core.ic=/setup/icon.png.fn=Living room	ca=199172.st=0.bs=FA8FCA6A0F32.nf=1.rs=...!.....x.......I.V.V.......x.....*
13:45:22.004656 IP varese-interface-501e2d68ee7a.home.mdns > mdns.mcast.net.mdns: 0 [2q] [3n] ANY (QM)? ae04ea60-8ad9-3020-3aa0-73e6cadc29a2._googlezone._tcp.local. ANY (QM)? ae04ea60-8ad9-3020-3aa0-73e6cadc29a2.local. (208)
E....j@...A....*........................$ae04ea60-8ad9-3020-3aa0-73e6cadc29a2._googlezone._tcp.local.....$ae04ea60-8ad9-3020-3aa0-73e6cadc29a2.B...............(#id=28AA0C4D4657250977621E58AD331DCF.CGS...!.....x......'..M.M.......x.....*
13:45:23.228983 IP varese-interface-501e2d68ee7a.home.mdns > mdns.mcast.net.mdns: 0*- [0q] 4/0/0 PTR VarM-CM-(se-Core-ae04ea608ad930203aa073e6cadc29a2._googlecast._tcp.local., (Cache flush) TXT "id=ae04ea608ad930203aa073e6cadc29a2" "cd=28AA0C4D4657250977621E58AD331DCF" "rm=" "ve=05" "md=VarM-CM-(se Core" "ic=/setup/icon.png" "fn=Living room" "ca=199172" "st=0" "bs=FA8FCA6A0F32" "nf=1" "rs=", (Cache flush) SRV ae04ea60-8ad9-3020-3aa0-73e6cadc29a2.local.:8009 0 0, (Cache flush) A 192.168.0.42 (351)
E..{..@...A....*.........g..............._googlecast._tcp.local........x.0-Var..se-Core-ae04ea608ad930203aa073e6cadc29a2..............#id=ae04ea608ad930203aa073e6cadc29a2#cd=28AA0C4D4657250977621E58AD331DCF.rm=.ve=05.md=Var..se Core.ic=/setup/icon.png.fn=Living room	ca=199172.st=0.bs=FA8FCA6A0F32.nf=1.rs=...!.....x.-.....I$ae04ea60-8ad9-3020-3aa0-73e6cadc29a2...(.......x.....*
13:45:23.234542 IP varese-interface-501e2d68ee7a.home.mdns > mdns.mcast.net.mdns: 0*- [0q] 4/0/0 PTR ae04ea60-8ad9-3020-3aa0-73e6cadc29a2._googlezone._tcp.local., (Cache flush) TXT "id=28AA0C4D4657250977621E58AD331DCF" "CGS", (Cache flush) SRV ae04ea60-8ad9-3020-3aa0-73e6cadc29a2.local.:10001 700 0, (Cache flush) A 192.168.0.42 (210)
E.....@...A....*...........?............._googlezone._tcp.local........x.'$ae04ea60-8ad9-3020-3aa0-73e6cadc29a2.............(#id=28AA0C4D4657250977621E58AD331DCF.CGS...!.....x.-....'.$ae04ea60-8ad9-3020-3aa0-73e6cadc29a2...........x.....*
13:45:24.354531 IP varese-interface-501e2d68ee7a.home.mdns > mdns.mcast.net.mdns: 0 [2q] [3n] ANY (QM)? VarM-CM-(se-Core-ae04ea608ad930203aa073e6cadc29a2._googlecast._tcp.local. ANY (QM)? ae04ea60-8ad9-3020-3aa0-73e6cadc29a2.local. (349)
E..y..@...@ ...*.........e..............-Var..se-Core-ae04ea608ad930203aa073e6cadc29a2._googlecast._tcp.local.....$ae04ea60-8ad9-3020-3aa0-73e6cadc29a2.K................#id=ae04ea608ad930203aa073e6cadc29a2#cd=28AA0C4D4657250977621E58AD331DCF.rm=.ve=05.md=Var..se Core.ic=/setup/icon.png.fn=Living room	ca=199172.st=0.bs=FA8FCA6A0F32.nf=1.rs=...!.....x.......I.V.V.......x.....*
13:45:24.360086 IP varese-interface-501e2d68ee7a.home.mdns > mdns.mcast.net.mdns: 0 [2q] [3n] ANY (QM)? ae04ea60-8ad9-3020-3aa0-73e6cadc29a2._googlezone._tcp.local. ANY (QM)? ae04ea60-8ad9-3020-3aa0-73e6cadc29a2.local. (208)
E.....@...@....*........................$ae04ea60-8ad9-3020-3aa0-73e6cadc29a2._googlezone._tcp.local.....$ae04ea60-8ad9-3020-3aa0-73e6cadc29a2.B...............(#id=28AA0C4D4657250977621E58AD331DCF.CGS...!.....x......'..M.M.......x.....*
13:45:24.557480 IP varese-interface-501e2d68ee7a.home.mdns > mdns.mcast.net.mdns: 0 [2q] [3n] ANY (QM)? VarM-CM-(se-Core-ae04ea608ad930203aa073e6cadc29a2._googlecast._tcp.local. ANY (QM)? ae04ea60-8ad9-3020-3aa0-73e6cadc29a2.local. (349)
E..y..@...@....*.........e..............-Var..se-Core-ae04ea608ad930203aa073e6cadc29a2._googlecast._tcp.local.....$ae04ea60-8ad9-3020-3aa0-73e6cadc29a2.K................#id=ae04ea608ad930203aa073e6cadc29a2#cd=28AA0C4D4657250977621E58AD331DCF.rm=.ve=05.md=Var..se Core.ic=/setup/icon.png.fn=Living room	ca=199172.st=0.bs=FA8FCA6A0F32.nf=1.rs=...!.....x.......I.V.V.......x.....*
13:45:24.562292 IP varese-interface-501e2d68ee7a.home.mdns > mdns.mcast.net.mdns: 0 [2q] [3n] ANY (QM)? ae04ea60-8ad9-3020-3aa0-73e6cadc29a2._googlezone._tcp.local. ANY (QM)? ae04ea60-8ad9-3020-3aa0-73e6cadc29a2.local. (208)
E.....@...@....*........................$ae04ea60-8ad9-3020-3aa0-73e6cadc29a2._googlezone._tcp.local.....$ae04ea60-8ad9-3020-3aa0-73e6cadc29a2.B...............(#id=28AA0C4D4657250977621E58AD331DCF.CGS...!.....x......'..M.M.......x.....*
13:45:24.868608 IP varese-interface-501e2d68ee7a.home.mdns > mdns.mcast.net.mdns: 0 [2q] [3n] ANY (QM)? VarM-CM-(se-Core-ae04ea608ad930203aa073e6cadc29a2._googlecast._tcp.local. ANY (QM)? ae04ea60-8ad9-3020-3aa0-73e6cadc29a2.local. (349)
E..y..@...@....*.........e..............-Var..se-Core-ae04ea608ad930203aa073e6cadc29a2._googlecast._tcp.local.....$ae04ea60-8ad9-3020-3aa0-73e6cadc29a2.K................#id=ae04ea608ad930203aa073e6cadc29a2#cd=28AA0C4D4657250977621E58AD331DCF.rm=.ve=05.md=Var..se Core.ic=/setup/icon.png.fn=Living room	ca=199172.st=0.bs=FA8FCA6A0F32.nf=1.rs=...!.....x.......I.V.V.......x.....*
13:45:24.874330 IP varese-interface-501e2d68ee7a.home.mdns > mdns.mcast.net.mdns: 0 [2q] [3n] ANY (QM)? ae04ea60-8ad9-3020-3aa0-73e6cadc29a2._googlezone._tcp.local. ANY (QM)? ae04ea60-8ad9-3020-3aa0-73e6cadc29a2.local. (208)
E.....@...@....*........................$ae04ea60-8ad9-3020-3aa0-73e6cadc29a2._googlezone._tcp.local.....$ae04ea60-8ad9-3020-3aa0-73e6cadc29a2.B...............(#id=28AA0C4D4657250977621E58AD331DCF.CGS...!.....x......'..M.M.......x.....*

