Last login: Fri Dec 12 13:40:47 on ttys001
zeki@Zekis-MacBook-Air ~ % sudo tcpdump -i en0 host 192.168.0.42 -A -s 0
Password:
tcpdump: verbose output suppressed, use -v[v]... for full protocol decode
listening on en0, link-type EN10MB (Ethernet), snapshot length 524288 bytes
13:43:10.000763 IP varese-interface-501e2d68ee7a.home.mdns > mdns.mcast.net.mdns: 0*- [0q] 4/0/0 PTR VarM-CM-(se-Core-ae04ea608ad930203aa073e6cadc29a2._googlecast._tcp.local., (Cache flush) TXT "id=ae04ea608ad930203aa073e6cadc29a2" "cd=28AA0C4D4657250977621E58AD331DCF" "rm=" "ve=05" "md=VarM-CM-(se Core" "ic=/setup/icon.png" "fn=Living room" "ca=199172" "st=0" "bs=FA8FCA6A0F32" "nf=1" "rs=", (Cache flush) SRV ae04ea60-8ad9-3020-3aa0-73e6cadc29a2.local.:8009 0 0, (Cache flush) A 192.168.0.42 (351)
E..{V.@........*.........g..............._googlecast._tcp.local........x.0-Var..se-Core-ae04ea608ad930203aa073e6cadc29a2..............#id=ae04ea608ad930203aa073e6cadc29a2#cd=28AA0C4D4657250977621E58AD331DCF.rm=.ve=05.md=Var..se Core.ic=/setup/icon.png.fn=Living room	ca=199172.st=0.bs=FA8FCA6A0F32.nf=1.rs=...!.....x.-.....I$ae04ea60-8ad9-3020-3aa0-73e6cadc29a2...(.......x.....*
13:43:10.007287 IP varese-interface-501e2d68ee7a.home.mdns > mdns.mcast.net.mdns: 0*- [0q] 4/0/0 PTR ae04ea60-8ad9-3020-3aa0-73e6cadc29a2._googlezone._tcp.local., (Cache flush) TXT "id=28AA0C4D4657250977621E58AD331DCF" "CGS", (Cache flush) SRV ae04ea60-8ad9-3020-3aa0-73e6cadc29a2.local.:10001 700 0, (Cache flush) A 192.168.0.42 (210)
E...V.@....U...*...........?............._googlezone._tcp.local........x.'$ae04ea60-8ad9-3020-3aa0-73e6cadc29a2.............(#id=28AA0C4D4657250977621E58AD331DCF.CGS...!.....x.-....'.$ae04ea60-8ad9-3020-3aa0-73e6cadc29a2...........x.....*
13:43:11.131244 IP varese-interface-501e2d68ee7a.home.mdns > mdns.mcast.net.mdns: 0 [2q] [3n] ANY (QM)? VarM-CM-(se-Core-ae04ea608ad930203aa073e6cadc29a2._googlecast._tcp.local. ANY (QM)? ae04ea60-8ad9-3020-3aa0-73e6cadc29a2.local. (349)
E..yW.@........*.........e..............-Var..se-Core-ae04ea608ad930203aa073e6cadc29a2._googlecast._tcp.local.....$ae04ea60-8ad9-3020-3aa0-73e6cadc29a2.K................#id=ae04ea608ad930203aa073e6cadc29a2#cd=28AA0C4D4657250977621E58AD331DCF.rm=.ve=05.md=Var..se Core.ic=/setup/icon.png.fn=Living room	ca=199172.st=0.bs=FA8FCA6A0F32.nf=1.rs=...!.....x.......I.V.V.......x.....*
13:43:11.133775 IP varese-interface-501e2d68ee7a.home.mdns > mdns.mcast.net.mdns: 0 [2q] [3n] ANY (QM)? ae04ea60-8ad9-3020-3aa0-73e6cadc29a2._googlezone._tcp.local. ANY (QM)? ae04ea60-8ad9-3020-3aa0-73e6cadc29a2.local. (208)
E...W.@....l...*........................$ae04ea60-8ad9-3020-3aa0-73e6cadc29a2._googlezone._tcp.local.....$ae04ea60-8ad9-3020-3aa0-73e6cadc29a2.B...............(#id=28AA0C4D4657250977621E58AD331DCF.CGS...!.....x......'..M.M.......x.....*
13:43:11.434281 IP varese-interface-501e2d68ee7a.home.mdns > mdns.mcast.net.mdns: 0 [2q] [3n] ANY (QM)? VarM-CM-(se-Core-ae04ea608ad930203aa073e6cadc29a2._googlecast._tcp.local. ANY (QM)? ae04ea60-8ad9-3020-3aa0-73e6cadc29a2.local. (349)
E..yW.@........*.........e..............-Var..se-Core-ae04ea608ad930203aa073e6cadc29a2._googlecast._tcp.local.....$ae04ea60-8ad9-3020-3aa0-73e6cadc29a2.K................#id=ae04ea608ad930203aa073e6cadc29a2#cd=28AA0C4D4657250977621E58AD331DCF.rm=.ve=05.md=Var..se Core.ic=/setup/icon.png.fn=Living room	ca=199172.st=0.bs=FA8FCA6A0F32.nf=1.rs=...!.....x.......I.V.V.......x.....*
13:43:11.440810 IP varese-interface-501e2d68ee7a.home.mdns > mdns.mcast.net.mdns: 0 [2q] [3n] ANY (QM)? ae04ea60-8ad9-3020-3aa0-73e6cadc29a2._googlezone._tcp.local. ANY (QM)? ae04ea60-8ad9-3020-3aa0-73e6cadc29a2.local. (208)
E...W.@....W...*........................$ae04ea60-8ad9-3020-3aa0-73e6cadc29a2._googlezone._tcp.local.....$ae04ea60-8ad9-3020-3aa0-73e6cadc29a2.B...............(#id=28AA0C4D4657250977621E58AD331DCF.CGS...!.....x......'..M.M.......x.....*
13:43:11.640433 IP varese-interface-501e2d68ee7a.home.mdns > mdns.mcast.net.mdns: 0 [2q] [3n] ANY (QM)? VarM-CM-(se-Core-ae04ea608ad930203aa073e6cadc29a2._googlecast._tcp.local. ANY (QM)? ae04ea60-8ad9-3020-3aa0-73e6cadc29a2.local. (349)
E..yX.@........*.........e..............-Var..se-Core-ae04ea608ad930203aa073e6cadc29a2._googlecast._tcp.local.....$ae04ea60-8ad9-3020-3aa0-73e6cadc29a2.K................#id=ae04ea608ad930203aa073e6cadc29a2#cd=28AA0C4D4657250977621E58AD331DCF.rm=.ve=05.md=Var..se Core.ic=/setup/icon.png.fn=Living room	ca=199172.st=0.bs=FA8FCA6A0F32.nf=1.rs=...!.....x.......I.V.V.......x.....*
13:43:11.646801 IP varese-interface-501e2d68ee7a.home.mdns > mdns.mcast.net.mdns: 0 [2q] [3n] ANY (QM)? ae04ea60-8ad9-3020-3aa0-73e6cadc29a2._googlezone._tcp.local. ANY (QM)? ae04ea60-8ad9-3020-3aa0-73e6cadc29a2.local. (208)
E...X.@..../...*........................$ae04ea60-8ad9-3020-3aa0-73e6cadc29a2._googlezone._tcp.local.....$ae04ea60-8ad9-3020-3aa0-73e6cadc29a2.B...............(#id=28AA0C4D4657250977621E58AD331DCF.CGS...!.....x......'..M.M.......x.....*
13:43:12.974226 IP varese-interface-501e2d68ee7a.home.mdns > mdns.mcast.net.mdns: 0*- [0q] 4/0/0 PTR VarM-CM-(se-Core-ae04ea608ad930203aa073e6cadc29a2._googlecast._tcp.local., (Cache flush) TXT "id=ae04ea608ad930203aa073e6cadc29a2" "cd=28AA0C4D4657250977621E58AD331DCF" "rm=" "ve=05" "md=VarM-CM-(se Core" "ic=/setup/icon.png" "fn=Living room" "ca=199172" "st=0" "bs=FA8FCA6A0F32" "nf=1" "rs=", (Cache flush) SRV ae04ea60-8ad9-3020-3aa0-73e6cadc29a2.local.:8009 0 0, (Cache flush) A 192.168.0.42 (351)
E..{X.@........*.........g..............._googlecast._tcp.local........x.0-Var..se-Core-ae04ea608ad930203aa073e6cadc29a2..............#id=ae04ea608ad930203aa073e6cadc29a2#cd=28AA0C4D4657250977621E58AD331DCF.rm=.ve=05.md=Var..se Core.ic=/setup/icon.png.fn=Living room	ca=199172.st=0.bs=FA8FCA6A0F32.nf=1.rs=...!.....x.-.....I$ae04ea60-8ad9-3020-3aa0-73e6cadc29a2...(.......x.....*
13:43:12.983714 IP varese-interface-501e2d68ee7a.home.mdns > mdns.mcast.net.mdns: 0*- [0q] 4/0/0 PTR ae04ea60-8ad9-3020-3aa0-73e6cadc29a2._googlezone._tcp.local., (Cache flush) TXT "id=28AA0C4D4657250977621E58AD331DCF" "CGS", (Cache flush) SRV ae04ea60-8ad9-3020-3aa0-73e6cadc29a2.local.:10001 700 0, (Cache flush) A 192.168.0.42 (210)
E...X.@....7...*...........?............._googlezone._tcp.local........x.'$ae04ea60-8ad9-3020-3aa0-73e6cadc29a2.............(#id=28AA0C4D4657250977621E58AD331DCF.CGS...!.....x.-....'.$ae04ea60-8ad9-3020-3aa0-73e6cadc29a2...........x.....*
13:43:14.203021 IP varese-interface-501e2d68ee7a.home.mdns > mdns.mcast.net.mdns: 0 [2q] [3n] ANY (QM)? VarM-CM-(se-Core-ae04ea608ad930203aa073e6cadc29a2._googlecast._tcp.local. ANY (QM)? ae04ea60-8ad9-3020-3aa0-73e6cadc29a2.local. (349)
E..yYI@....\...*.........e..............-Var..se-Core-ae04ea608ad930203aa073e6cadc29a2._googlecast._tcp.local.....$ae04ea60-8ad9-3020-3aa0-73e6cadc29a2.K................#id=ae04ea608ad930203aa073e6cadc29a2#cd=28AA0C4D4657250977621E58AD331DCF.rm=.ve=05.md=Var..se Core.ic=/setup/icon.png.fn=Living room	ca=199172.st=0.bs=FA8FCA6A0F32.nf=1.rs=...!.....x.......I.V.V.......x.....*
13:43:14.408044 IP varese-interface-501e2d68ee7a.home.mdns > mdns.mcast.net.mdns: 0 [2q] [3n] ANY (QM)? VarM-CM-(se-Core-ae04ea608ad930203aa073e6cadc29a2._googlecast._tcp.local. ANY (QM)? ae04ea60-8ad9-3020-3aa0-73e6cadc29a2.local. (349)
E..yY.@.... ...*.........e..............-Var..se-Core-ae04ea608ad930203aa073e6cadc29a2._googlecast._tcp.local.....$ae04ea60-8ad9-3020-3aa0-73e6cadc29a2.K................#id=ae04ea608ad930203aa073e6cadc29a2#cd=28AA0C4D4657250977621E58AD331DCF.rm=.ve=05.md=Var..se Core.ic=/setup/icon.png.fn=Living room	ca=199172.st=0.bs=FA8FCA6A0F32.nf=1.rs=...!.....x.......I.V.V.......x.....*
13:43:14.413398 IP varese-interface-501e2d68ee7a.home.mdns > mdns.mcast.net.mdns: 0 [2q] [3n] ANY (QM)? ae04ea60-8ad9-3020-3aa0-73e6cadc29a2._googlezone._tcp.local. ANY (QM)? ae04ea60-8ad9-3020-3aa0-73e6cadc29a2.local. (208)
E...Y.@........*........................$ae04ea60-8ad9-3020-3aa0-73e6cadc29a2._googlezone._tcp.local.....$ae04ea60-8ad9-3020-3aa0-73e6cadc29a2.B...............(#id=28AA0C4D4657250977621E58AD331DCF.CGS...!.....x......'..M.M.......x.....*
13:43:14.719601 IP varese-interface-501e2d68ee7a.home.mdns > mdns.mcast.net.mdns: 0 [2q] [3n] ANY (QM)? VarM-CM-(se-Core-ae04ea608ad930203aa073e6cadc29a2._googlecast._tcp.local. ANY (QM)? ae04ea60-8ad9-3020-3aa0-73e6cadc29a2.local. (349)
E..yY.@...~....*.........e..............-Var..se-Core-ae04ea608ad930203aa073e6cadc29a2._googlecast._tcp.local.....$ae04ea60-8ad9-3020-3aa0-73e6cadc29a2.K................#id=ae04ea608ad930203aa073e6cadc29a2#cd=28AA0C4D4657250977621E58AD331DCF.rm=.ve=05.md=Var..se Core.ic=/setup/icon.png.fn=Living room	ca=199172.st=0.bs=FA8FCA6A0F32.nf=1.rs=...!.....x.......I.V.V.......x.....*
13:43:14.812528 IP varese-interface-501e2d68ee7a.home.mdns > mdns.mcast.net.mdns: 0 [2q] [3n] ANY (QM)? ae04ea60-8ad9-3020-3aa0-73e6cadc29a2._googlezone._tcp.local. ANY (QM)? ae04ea60-8ad9-3020-3aa0-73e6cadc29a2.local. (208)
E...Y.@....q...*........................$ae04ea60-8ad9-3020-3aa0-73e6cadc29a2._googlezone._tcp.local.....$ae04ea60-8ad9-3020-3aa0-73e6cadc29a2.B...............(#id=28AA0C4D4657250977621E58AD331DCF.CGS...!.....x......'..M.M.......x.....*
13:43:15.943846 IP varese-interface-501e2d68ee7a.home.mdns > mdns.mcast.net.mdns: 0*- [0q] 4/0/0 PTR VarM-CM-(se-Core-ae04ea608ad930203aa073e6cadc29a2._googlecast._tcp.local., (Cache flush) TXT "id=ae04ea608ad930203aa073e6cadc29a2" "cd=28AA0C4D4657250977621E58AD331DCF" "rm=" "ve=05" "md=VarM-CM-(se Core" "ic=/setup/icon.png" "fn=Living room" "ca=199172" "st=0" "bs=FA8FCA6A0F32" "nf=1" "rs=", (Cache flush) SRV ae04ea60-8ad9-3020-3aa0-73e6cadc29a2.local.:8009 0 0, (Cache flush) A 192.168.0.42 (351)
E..{Z.@...~....*.........g..............._googlecast._tcp.local........x.0-Var..se-Core-ae04ea608ad930203aa073e6cadc29a2..............#id=ae04ea608ad930203aa073e6cadc29a2#cd=28AA0C4D4657250977621E58AD331DCF.rm=.ve=05.md=Var..se Core.ic=/setup/icon.png.fn=Living room	ca=199172.st=0.bs=FA8FCA6A0F32.nf=1.rs=...!.....x.-.....I$ae04ea60-8ad9-3020-3aa0-73e6cadc29a2...(.......x.....*
13:43:15.946530 IP varese-interface-501e2d68ee7a.home.mdns > mdns.mcast.net.mdns: 0*- [0q] 4/0/0 PTR ae04ea60-8ad9-3020-3aa0-73e6cadc29a2._googlezone._tcp.local., (Cache flush) TXT "id=28AA0C4D4657250977621E58AD331DCF" "CGS", (Cache flush) SRV ae04ea60-8ad9-3020-3aa0-73e6cadc29a2.local.:10001 700 0, (Cache flush) A 192.168.0.42 (210)
E...Z.@...~....*...........?............._googlezone._tcp.local........x.'$ae04ea60-8ad9-3020-3aa0-73e6cadc29a2.............(#id=28AA0C4D4657250977621E58AD331DCF.CGS...!.....x.-....'.$ae04ea60-8ad9-3020-3aa0-73e6cadc29a2...........x.....*
13:43:16.963888 IP varese-interface-501e2d68ee7a.home.mdns > mdns.mcast.net.mdns: 0 [2q] [3n] ANY (QM)? VarM-CM-(se-Core-ae04ea608ad930203aa073e6cadc29a2._googlecast._tcp.local. ANY (QM)? ae04ea60-8ad9-3020-3aa0-73e6cadc29a2.local. (349)
E..yZ.@...}....*.........e..............-Var..se-Core-ae04ea608ad930203aa073e6cadc29a2._googlecast._tcp.local.....$ae04ea60-8ad9-3020-3aa0-73e6cadc29a2.K................#id=ae04ea608ad930203aa073e6cadc29a2#cd=28AA0C4D4657250977621E58AD331DCF.rm=.ve=05.md=Var..se Core.ic=/setup/icon.png.fn=Living room	ca=199172.st=0.bs=FA8FCA6A0F32.nf=1.rs=...!.....x.......I.V.V.......x.....*
13:43:16.974417 IP varese-interface-501e2d68ee7a.home.mdns > mdns.mcast.net.mdns: 0 [2q] [3n] ANY (QM)? ae04ea60-8ad9-3020-3aa0-73e6cadc29a2._googlezone._tcp.local. ANY (QM)? ae04ea60-8ad9-3020-3aa0-73e6cadc29a2.local. (208)
E...Z.@...~x...*........................$ae04ea60-8ad9-3020-3aa0-73e6cadc29a2._googlezone._tcp.local.....$ae04ea60-8ad9-3020-3aa0-73e6cadc29a2.B...............(#id=28AA0C4D4657250977621E58AD331DCF.CGS...!.....x......'..M.M.......x.....*
13:43:17.271235 IP varese-interface-501e2d68ee7a.home.mdns > mdns.mcast.net.mdns: 0 [2q] [3n] ANY (QM)? VarM-CM-(se-Core-ae04ea608ad930203aa073e6cadc29a2._googlecast._tcp.local. ANY (QM)? ae04ea60-8ad9-3020-3aa0-73e6cadc29a2.local. (349)
E..yZ.@...}....*.........e..............-Var..se-Core-ae04ea608ad930203aa073e6cadc29a2._googlecast._tcp.local.....$ae04ea60-8ad9-3020-3aa0-73e6cadc29a2.K................#id=ae04ea608ad930203aa073e6cadc29a2#cd=28AA0C4D4657250977621E58AD331DCF.rm=.ve=05.md=Var..se Core.ic=/setup/icon.png.fn=Living room	ca=199172.st=0.bs=FA8FCA6A0F32.nf=1.rs=...!.....x.......I.V.V.......x.....*
13:43:17.277703 IP varese-interface-501e2d68ee7a.home.mdns > mdns.mcast.net.mdns: 0 [2q] [3n] ANY (QM)? ae04ea60-8ad9-3020-3aa0-73e6cadc29a2._googlezone._tcp.local. ANY (QM)? ae04ea60-8ad9-3020-3aa0-73e6cadc29a2.local. (208)
E...Z.@...~F...*........................$ae04ea60-8ad9-3020-3aa0-73e6cadc29a2._googlezone._tcp.local.....$ae04ea60-8ad9-3020-3aa0-73e6cadc29a2.B...............(#id=28AA0C4D4657250977621E58AD331DCF.CGS...!.....x......'..M.M.......x.....*
13:43:17.483501 IP varese-interface-501e2d68ee7a.home.mdns > mdns.mcast.net.mdns: 0 [2q] [3n] ANY (QM)? ae04ea60-8ad9-3020-3aa0-73e6cadc29a2._googlezone._tcp.local. ANY (QM)? ae04ea60-8ad9-3020-3aa0-73e6cadc29a2.local. (208)
E...[.@...~....*........................$ae04ea60-8ad9-3020-3aa0-73e6cadc29a2._googlezone._tcp.local.....$ae04ea60-8ad9-3020-3aa0-73e6cadc29a2.B...............(#id=28AA0C4D4657250977621E58AD331DCF.CGS...!.....x......'..M.M.......x.....*
13:43:18.713452 IP varese-interface-501e2d68ee7a.home.mdns > mdns.mcast.net.mdns: 0*- [0q] 4/0/0 PTR ae04ea60-8ad9-3020-3aa0-73e6cadc29a2._googlezone._tcp.local., (Cache flush) TXT "id=28AA0C4D4657250977621E58AD331DCF" "CGS", (Cache flush) SRV ae04ea60-8ad9-3020-3aa0-73e6cadc29a2.local.:10001 700 0, (Cache flush) A 192.168.0.42 (210)
E...[M@...}....*...........?............._googlezone._tcp.local........x.'$ae04ea60-8ad9-3020-3aa0-73e6cadc29a2.............(#id=28AA0C4D4657250977621E58AD331DCF.CGS...!.....x.-....'.$ae04ea60-8ad9-3020-3aa0-73e6cadc29a2...........x.....*
13:43:20.035912 IP varese-interface-501e2d68ee7a.home.mdns > mdns.mcast.net.mdns: 0 [2q] [3n] ANY (QM)? VarM-CM-(se-Core-ae04ea608ad930203aa073e6cadc29a2._googlecast._tcp.local. ANY (QM)? ae04ea60-8ad9-3020-3aa0-73e6cadc29a2.local. (349)
E..y[o@...}6...*.........e..............-Var..se-Core-ae04ea608ad930203aa073e6cadc29a2._googlecast._tcp.local.....$ae04ea60-8ad9-3020-3aa0-73e6cadc29a2.K................#id=ae04ea608ad930203aa073e6cadc29a2#cd=28AA0C4D4657250977621E58AD331DCF.rm=.ve=05.md=Var..se Core.ic=/setup/icon.png.fn=Living room	ca=199172.st=0.bs=FA8FCA6A0F32.nf=1.rs=...!.....x.......I.V.V.......x.....*
13:43:20.042635 IP varese-interface-501e2d68ee7a.home.mdns > mdns.mcast.net.mdns: 0 [2q] [3n] ANY (QM)? ae04ea60-8ad9-3020-3aa0-73e6cadc29a2._googlezone._tcp.local. ANY (QM)? ae04ea60-8ad9-3020-3aa0-73e6cadc29a2.local. (208)
E...[p@...}....*........................$ae04ea60-8ad9-3020-3aa0-73e6cadc29a2._googlezone._tcp.local.....$ae04ea60-8ad9-3020-3aa0-73e6cadc29a2.B...............(#id=28AA0C4D4657250977621E58AD331DCF.CGS...!.....x......'..M.M.......x.....*
13:43:20.240808 IP varese-interface-501e2d68ee7a.home.mdns > mdns.mcast.net.mdns: 0 [2q] [3n] ANY (QM)? VarM-CM-(se-Core-ae04ea608ad930203aa073e6cadc29a2._googlecast._tcp.local. ANY (QM)? ae04ea60-8ad9-3020-3aa0-73e6cadc29a2.local. (349)
E..y[.@...}....*.........e..............-Var..se-Core-ae04ea608ad930203aa073e6cadc29a2._googlecast._tcp.local.....$ae04ea60-8ad9-3020-3aa0-73e6cadc29a2.K................#id=ae04ea608ad930203aa073e6cadc29a2#cd=28AA0C4D4657250977621E58AD331DCF.rm=.ve=05.md=Var..se Core.ic=/setup/icon.png.fn=Living room	ca=199172.st=0.bs=FA8FCA6A0F32.nf=1.rs=...!.....x.......I.V.V.......x.....*
13:43:20.247386 IP varese-interface-501e2d68ee7a.home.mdns > mdns.mcast.net.mdns: 0 [2q] [3n] ANY (QM)? ae04ea60-8ad9-3020-3aa0-73e6cadc29a2._googlezone._tcp.local. ANY (QM)? ae04ea60-8ad9-3020-3aa0-73e6cadc29a2.local. (208)
E...[.@...}....*........................$ae04ea60-8ad9-3020-3aa0-73e6cadc29a2._googlezone._tcp.local.....$ae04ea60-8ad9-3020-3aa0-73e6cadc29a2.B...............(#id=28AA0C4D4657250977621E58AD331DCF.CGS...!.....x......'..M.M.......x.....*
13:43:20.554529 IP varese-interface-501e2d68ee7a.home.mdns > mdns.mcast.net.mdns: 0 [2q] [3n] ANY (QM)? ae04ea60-8ad9-3020-3aa0-73e6cadc29a2._googlezone._tcp.local. ANY (QM)? ae04ea60-8ad9-3020-3aa0-73e6cadc29a2.local. (208)
E...[.@...}i...*........................$ae04ea60-8ad9-3020-3aa0-73e6cadc29a2._googlezone._tcp.local.....$ae04ea60-8ad9-3020-3aa0-73e6cadc29a2.B...............(#id=28AA0C4D4657250977621E58AD331DCF.CGS...!.....x......'..M.M.......x.....*
13:43:21.776919 IP varese-interface-501e2d68ee7a.home.mdns > mdns.mcast.net.mdns: 0*- [0q] 4/0/0 PTR VarM-CM-(se-Core-ae04ea608ad930203aa073e6cadc29a2._googlecast._tcp.local., (Cache flush) TXT "id=ae04ea608ad930203aa073e6cadc29a2" "cd=28AA0C4D4657250977621E58AD331DCF" "rm=" "ve=05" "md=VarM-CM-(se Core" "ic=/setup/icon.png" "fn=Living room" "ca=199172" "st=0" "bs=FA8FCA6A0F32" "nf=1" "rs=", (Cache flush) SRV ae04ea60-8ad9-3020-3aa0-73e6cadc29a2.local.:8009 0 0, (Cache flush) A 192.168.0.42 (351)
E..{[.@...|....*.........g..............._googlecast._tcp.local........x.0-Var..se-Core-ae04ea608ad930203aa073e6cadc29a2..............#id=ae04ea608ad930203aa073e6cadc29a2#cd=28AA0C4D4657250977621E58AD331DCF.rm=.ve=05.md=Var..se Core.ic=/setup/icon.png.fn=Living room	ca=199172.st=0.bs=FA8FCA6A0F32.nf=1.rs=...!.....x.-.....I$ae04ea60-8ad9-3020-3aa0-73e6cadc29a2...(.......x.....*
13:43:21.782559 IP varese-interface-501e2d68ee7a.home.mdns > mdns.mcast.net.mdns: 0*- [0q] 4/0/0 PTR ae04ea60-8ad9-3020-3aa0-73e6cadc29a2._googlezone._tcp.local., (Cache flush) TXT "id=28AA0C4D4657250977621E58AD331DCF" "CGS", (Cache flush) SRV ae04ea60-8ad9-3020-3aa0-73e6cadc29a2.local.:10001 700 0, (Cache flush) A 192.168.0.42 (210)
E...[.@...}G...*...........?............._googlezone._tcp.local........x.'$ae04ea60-8ad9-3020-3aa0-73e6cadc29a2.............(#id=28AA0C4D4657250977621E58AD331DCF.CGS...!.....x.-....'.$ae04ea60-8ad9-3020-3aa0-73e6cadc29a2...........x.....*
13:43:22.907065 IP varese-interface-501e2d68ee7a.home.mdns > mdns.mcast.net.mdns: 0 [2q] [3n] ANY (QM)? VarM-CM-(se-Core-ae04ea608ad930203aa073e6cadc29a2._googlecast._tcp.local. ANY (QM)? ae04ea60-8ad9-3020-3aa0-73e6cadc29a2.local. (349)
E..y\.@...|....*.........e..............-Var..se-Core-ae04ea608ad930203aa073e6cadc29a2._googlecast._tcp.local.....$ae04ea60-8ad9-3020-3aa0-73e6cadc29a2.K................#id=ae04ea608ad930203aa073e6cadc29a2#cd=28AA0C4D4657250977621E58AD331DCF.rm=.ve=05.md=Var..se Core.ic=/setup/icon.png.fn=Living room	ca=199172.st=0.bs=FA8FCA6A0F32.nf=1.rs=...!.....x.......I.V.V.......x.....*
13:43:22.909681 IP varese-interface-501e2d68ee7a.home.mdns > mdns.mcast.net.mdns: 0 [2q] [3n] ANY (QM)? ae04ea60-8ad9-3020-3aa0-73e6cadc29a2._googlezone._tcp.local. ANY (QM)? ae04ea60-8ad9-3020-3aa0-73e6cadc29a2.local. (208)
E...\.@...}....*........................$ae04ea60-8ad9-3020-3aa0-73e6cadc29a2._googlezone._tcp.local.....$ae04ea60-8ad9-3020-3aa0-73e6cadc29a2.B...............(#id=28AA0C4D4657250977621E58AD331DCF.CGS...!.....x......'..M.M.......x.....*
13:43:23.210582 IP varese-interface-501e2d68ee7a.home.mdns > mdns.mcast.net.mdns: 0 [2q] [3n] ANY (QM)? VarM-CM-(se-Core-ae04ea608ad930203aa073e6cadc29a2._googlecast._tcp.local. ANY (QM)? ae04ea60-8ad9-3020-3aa0-73e6cadc29a2.local. (349)
E..y\A@...|d...*.........e..............-Var..se-Core-ae04ea608ad930203aa073e6cadc29a2._googlecast._tcp.local.....$ae04ea60-8ad9-3020-3aa0-73e6cadc29a2.K................#id=ae04ea608ad930203aa073e6cadc29a2#cd=28AA0C4D4657250977621E58AD331DCF.rm=.ve=05.md=Var..se Core.ic=/setup/icon.png.fn=Living room	ca=199172.st=0.bs=FA8FCA6A0F32.nf=1.rs=...!.....x.......I.V.V.......x.....*
13:43:23.217199 IP varese-interface-501e2d68ee7a.home.mdns > mdns.mcast.net.mdns: 0 [2q] [3n] ANY (QM)? ae04ea60-8ad9-3020-3aa0-73e6cadc29a2._googlezone._tcp.local. ANY (QM)? ae04ea60-8ad9-3020-3aa0-73e6cadc29a2.local. (208)
E...\B@...|....*........................$ae04ea60-8ad9-3020-3aa0-73e6cadc29a2._googlezone._tcp.local.....$ae04ea60-8ad9-3020-3aa0-73e6cadc29a2.B...............(#id=28AA0C4D4657250977621E58AD331DCF.CGS...!.....x......'..M.M.......x.....*
13:43:23.419122 IP varese-interface-501e2d68ee7a.home.mdns > mdns.mcast.net.mdns: 0 [2q] [3n] ANY (QM)? VarM-CM-(se-Core-ae04ea608ad930203aa073e6cadc29a2._googlecast._tcp.local. ANY (QM)? ae04ea60-8ad9-3020-3aa0-73e6cadc29a2.local. (349)
E..y\I@...|\...*.........e..............-Var..se-Core-ae04ea608ad930203aa073e6cadc29a2._googlecast._tcp.local.....$ae04ea60-8ad9-3020-3aa0-73e6cadc29a2.K................#id=ae04ea608ad930203aa073e6cadc29a2#cd=28AA0C4D4657250977621E58AD331DCF.rm=.ve=05.md=Var..se Core.ic=/setup/icon.png.fn=Living room	ca=199172.st=0.bs=FA8FCA6A0F32.nf=1.rs=...!.....x.......I.V.V.......x.....*
13:43:23.422016 IP varese-interface-501e2d68ee7a.home.mdns > mdns.mcast.net.mdns: 0 [2q] [3n] ANY (QM)? ae04ea60-8ad9-3020-3aa0-73e6cadc29a2._googlezone._tcp.local. ANY (QM)? ae04ea60-8ad9-3020-3aa0-73e6cadc29a2.local. (208)
E...\J@...|....*........................$ae04ea60-8ad9-3020-3aa0-73e6cadc29a2._googlezone._tcp.local.....$ae04ea60-8ad9-3020-3aa0-73e6cadc29a2.B...............(#id=28AA0C4D4657250977621E58AD331DCF.CGS...!.....x......'..M.M.......x.....*
13:43:24.750365 IP varese-interface-501e2d68ee7a.home.mdns > mdns.mcast.net.mdns: 0*- [0q] 4/0/0 PTR VarM-CM-(se-Core-ae04ea608ad930203aa073e6cadc29a2._googlecast._tcp.local., (Cache flush) TXT "id=ae04ea608ad930203aa073e6cadc29a2" "cd=28AA0C4D4657250977621E58AD331DCF" "rm=" "ve=05" "md=VarM-CM-(se Core" "ic=/setup/icon.png" "fn=Living room" "ca=199172" "st=0" "bs=FA8FCA6A0F32" "nf=1" "rs=", (Cache flush) SRV ae04ea60-8ad9-3020-3aa0-73e6cadc29a2.local.:8009 0 0, (Cache flush) A 192.168.0.42 (351)
E..{\.@...{....*.........g..............._googlecast._tcp.local........x.0-Var..se-Core-ae04ea608ad930203aa073e6cadc29a2..............#id=ae04ea608ad930203aa073e6cadc29a2#cd=28AA0C4D4657250977621E58AD331DCF.rm=.ve=05.md=Var..se Core.ic=/setup/icon.png.fn=Living room	ca=199172.st=0.bs=FA8FCA6A0F32.nf=1.rs=...!.....x.-.....I$ae04ea60-8ad9-3020-3aa0-73e6cadc29a2...(.......x.....*
13:43:24.755949 IP varese-interface-501e2d68ee7a.home.mdns > mdns.mcast.net.mdns: 0*- [0q] 4/0/0 PTR ae04ea60-8ad9-3020-3aa0-73e6cadc29a2._googlezone._tcp.local., (Cache flush) TXT "id=28AA0C4D4657250977621E58AD331DCF" "CGS", (Cache flush) SRV ae04ea60-8ad9-3020-3aa0-73e6cadc29a2.local.:10001 700 0, (Cache flush) A 192.168.0.42 (210)
E...\.@...|4...*...........?............._googlezone._tcp.local........x.'$ae04ea60-8ad9-3020-3aa0-73e6cadc29a2.............(#id=28AA0C4D4657250977621E58AD331DCF.CGS...!.....x.-....'.$ae04ea60-8ad9-3020-3aa0-73e6cadc29a2...........x.....*
13:43:25.877841 IP varese-interface-501e2d68ee7a.home.mdns > mdns.mcast.net.mdns: 0 [2q] [3n] ANY (QM)? VarM-CM-(se-Core-ae04ea608ad930203aa073e6cadc29a2._googlecast._tcp.local. ANY (QM)? ae04ea60-8ad9-3020-3aa0-73e6cadc29a2.local. (349)
E..y]T@...{Q...*.........e..............-Var..se-Core-ae04ea608ad930203aa073e6cadc29a2._googlecast._tcp.local.....$ae04ea60-8ad9-3020-3aa0-73e6cadc29a2.K................#id=ae04ea608ad930203aa073e6cadc29a2#cd=28AA0C4D4657250977621E58AD331DCF.rm=.ve=05.md=Var..se Core.ic=/setup/icon.png.fn=Living room	ca=199172.st=0.bs=FA8FCA6A0F32.nf=1.rs=...!.....x.......I.V.V.......x.....*
13:43:25.880519 IP varese-interface-501e2d68ee7a.home.mdns > mdns.mcast.net.mdns: 0 [2q] [3n] ANY (QM)? ae04ea60-8ad9-3020-3aa0-73e6cadc29a2._googlezone._tcp.local. ANY (QM)? ae04ea60-8ad9-3020-3aa0-73e6cadc29a2.local. (208)
E...]U@...{....*........................$ae04ea60-8ad9-3020-3aa0-73e6cadc29a2._googlezone._tcp.local.....$ae04ea60-8ad9-3020-3aa0-73e6cadc29a2.B...............(#id=28AA0C4D4657250977621E58AD331DCF.CGS...!.....x......'..M.M.......x.....*
13:43:26.183918 IP varese-interface-501e2d68ee7a.home.mdns > mdns.mcast.net.mdns: 0 [2q] [3n] ANY (QM)? VarM-CM-(se-Core-ae04ea608ad930203aa073e6cadc29a2._googlecast._tcp.local. ANY (QM)? ae04ea60-8ad9-3020-3aa0-73e6cadc29a2.local. (349)
E..y].@...{....*.........e..............-Var..se-Core-ae04ea608ad930203aa073e6cadc29a2._googlecast._tcp.local.....$ae04ea60-8ad9-3020-3aa0-73e6cadc29a2.K................#id=ae04ea608ad930203aa073e6cadc29a2#cd=28AA0C4D4657250977621E58AD331DCF.rm=.ve=05.md=Var..se Core.ic=/setup/icon.png.fn=Living room	ca=199172.st=0.bs=FA8FCA6A0F32.nf=1.rs=...!.....x.......I.V.V.......x.....*
13:43:26.189341 IP varese-interface-501e2d68ee7a.home.mdns > mdns.mcast.net.mdns: 0 [2q] [3n] ANY (QM)? ae04ea60-8ad9-3020-3aa0-73e6cadc29a2._googlezone._tcp.local. ANY (QM)? ae04ea60-8ad9-3020-3aa0-73e6cadc29a2.local. (208)
E...].@...{....*........................$ae04ea60-8ad9-3020-3aa0-73e6cadc29a2._googlezone._tcp.local.....$ae04ea60-8ad9-3020-3aa0-73e6cadc29a2.B...............(#id=28AA0C4D4657250977621E58AD331DCF.CGS...!.....x......'..M.M.......x.....*
13:43:26.384553 IP varese-interface-501e2d68ee7a.home.mdns > mdns.mcast.net.mdns: 0 [2q] [3n] ANY (QM)? VarM-CM-(se-Core-ae04ea608ad930203aa073e6cadc29a2._googlecast._tcp.local. ANY (QM)? ae04ea60-8ad9-3020-3aa0-73e6cadc29a2.local. (349)
E..y].@...{....*.........e..............-Var..se-Core-ae04ea608ad930203aa073e6cadc29a2._googlecast._tcp.local.....$ae04ea60-8ad9-3020-3aa0-73e6cadc29a2.K................#id=ae04ea608ad930203aa073e6cadc29a2#cd=28AA0C4D4657250977621E58AD331DCF.rm=.ve=05.md=Var..se Core.ic=/setup/icon.png.fn=Living room	ca=199172.st=0.bs=FA8FCA6A0F32.nf=1.rs=...!.....x.......I.V.V.......x.....*
13:43:26.391336 IP varese-interface-501e2d68ee7a.home.mdns > mdns.mcast.net.mdns: 0 [2q] [3n] ANY (QM)? ae04ea60-8ad9-3020-3aa0-73e6cadc29a2._googlezone._tcp.local. ANY (QM)? ae04ea60-8ad9-3020-3aa0-73e6cadc29a2.local. (208)
E...].@...{....*........................$ae04ea60-8ad9-3020-3aa0-73e6cadc29a2._googlezone._tcp.local.....$ae04ea60-8ad9-3020-3aa0-73e6cadc29a2.B...............(#id=28AA0C4D4657250977621E58AD331DCF.CGS...!.....x......'..M.M.......x.....*
13:43:27.722601 IP varese-interface-501e2d68ee7a.home.mdns > mdns.mcast.net.mdns: 0*- [0q] 4/0/0 PTR ae04ea60-8ad9-3020-3aa0-73e6cadc29a2._googlezone._tcp.local., (Cache flush) TXT "id=28AA0C4D4657250977621E58AD331DCF" "CGS", (Cache flush) SRV ae04ea60-8ad9-3020-3aa0-73e6cadc29a2.local.:10001 700 0, (Cache flush) A 192.168.0.42 (210)
E...^.@...z....*...........?............._googlezone._tcp.local........x.'$ae04ea60-8ad9-3020-3aa0-73e6cadc29a2.............(#id=28AA0C4D4657250977621E58AD331DCF.CGS...!.....x.-....'.$ae04ea60-8ad9-3020-3aa0-73e6cadc29a2...........x.....*
13:43:28.948842 IP varese-interface-501e2d68ee7a.home.mdns > mdns.mcast.net.mdns: 0 [2q] [3n] ANY (QM)? VarM-CM-(se-Core-ae04ea608ad930203aa073e6cadc29a2._googlecast._tcp.local. ANY (QM)? ae04ea60-8ad9-3020-3aa0-73e6cadc29a2.local. (349)
E..y_G@...y^...*.........e..............-Var..se-Core-ae04ea608ad930203aa073e6cadc29a2._googlecast._tcp.local.....$ae04ea60-8ad9-3020-3aa0-73e6cadc29a2.K................#id=ae04ea608ad930203aa073e6cadc29a2#cd=28AA0C4D4657250977621E58AD331DCF.rm=.ve=05.md=Var..se Core.ic=/setup/icon.png.fn=Living room	ca=199172.st=0.bs=FA8FCA6A0F32.nf=1.rs=...!.....x.......I.V.V.......x.....*
13:43:28.954312 IP varese-interface-501e2d68ee7a.home.mdns > mdns.mcast.net.mdns: 0 [2q] [3n] ANY (QM)? ae04ea60-8ad9-3020-3aa0-73e6cadc29a2._googlezone._tcp.local. ANY (QM)? ae04ea60-8ad9-3020-3aa0-73e6cadc29a2.local. (208)
E..._H@...y....*........................$ae04ea60-8ad9-3020-3aa0-73e6cadc29a2._googlezone._tcp.local.....$ae04ea60-8ad9-3020-3aa0-73e6cadc29a2.B...............(#id=28AA0C4D4657250977621E58AD331DCF.CGS...!.....x......'..M.M.......x.....*
13:43:29.151734 IP varese-interface-501e2d68ee7a.home.mdns > mdns.mcast.net.mdns: 0 [2q] [3n] ANY (QM)? VarM-CM-(se-Core-ae04ea608ad930203aa073e6cadc29a2._googlecast._tcp.local. ANY (QM)? ae04ea60-8ad9-3020-3aa0-73e6cadc29a2.local. (349)
E..y_\@...yI...*.........e..............-Var..se-Core-ae04ea608ad930203aa073e6cadc29a2._googlecast._tcp.local.....$ae04ea60-8ad9-3020-3aa0-73e6cadc29a2.K................#id=ae04ea608ad930203aa073e6cadc29a2#cd=28AA0C4D4657250977621E58AD331DCF.rm=.ve=05.md=Var..se Core.ic=/setup/icon.png.fn=Living room	ca=199172.st=0.bs=FA8FCA6A0F32.nf=1.rs=...!.....x.......I.V.V.......x.....*
13:43:29.161329 IP varese-interface-501e2d68ee7a.home.mdns > mdns.mcast.net.mdns: 0 [2q] [3n] ANY (QM)? ae04ea60-8ad9-3020-3aa0-73e6cadc29a2._googlezone._tcp.local. ANY (QM)? ae04ea60-8ad9-3020-3aa0-73e6cadc29a2.local. (208)
E..._]@...y....*........................$ae04ea60-8ad9-3020-3aa0-73e6cadc29a2._googlezone._tcp.local.....$ae04ea60-8ad9-3020-3aa0-73e6cadc29a2.B...............(#id=28AA0C4D4657250977621E58AD331DCF.CGS...!.....x......'..M.M.......x.....*
13:43:29.460765 IP varese-interface-501e2d68ee7a.home.mdns > mdns.mcast.net.mdns: 0 [2q] [3n] ANY (QM)? VarM-CM-(se-Core-ae04ea608ad930203aa073e6cadc29a2._googlecast._tcp.local. ANY (QM)? ae04ea60-8ad9-3020-3aa0-73e6cadc29a2.local. (349)
E..y_.@...y....*.........e..............-Var..se-Core-ae04ea608ad930203aa073e6cadc29a2._googlecast._tcp.local.....$ae04ea60-8ad9-3020-3aa0-73e6cadc29a2.K................#id=ae04ea608ad930203aa073e6cadc29a2#cd=28AA0C4D4657250977621E58AD331DCF.rm=.ve=05.md=Var..se Core.ic=/setup/icon.png.fn=Living room	ca=199172.st=0.bs=FA8FCA6A0F32.nf=1.rs=...!.....x.......I.V.V.......x.....*
13:43:29.466196 IP varese-interface-501e2d68ee7a.home.mdns > mdns.mcast.net.mdns: 0 [2q] [3n] ANY (QM)? ae04ea60-8ad9-3020-3aa0-73e6cadc29a2._googlezone._tcp.local. ANY (QM)? ae04ea60-8ad9-3020-3aa0-73e6cadc29a2.local. (208)
E..._.@...y....*........................$ae04ea60-8ad9-3020-3aa0-73e6cadc29a2._googlezone._tcp.local.....$ae04ea60-8ad9-3020-3aa0-73e6cadc29a2.B...............(#id=28AA0C4D4657250977621E58AD331DCF.CGS...!.....x......'..M.M.......x.....*
13:43:30.691328 IP varese-interface-501e2d68ee7a.home.mdns > mdns.mcast.net.mdns: 0*- [0q] 4/0/0 PTR VarM-CM-(se-Core-ae04ea608ad930203aa073e6cadc29a2._googlecast._tcp.local., (Cache flush) TXT "id=ae04ea608ad930203aa073e6cadc29a2" "cd=28AA0C4D4657250977621E58AD331DCF" "rm=" "ve=05" "md=VarM-CM-(se Core" "ic=/setup/icon.png" "fn=Living room" "ca=199172" "st=0" "bs=FA8FCA6A0F32" "nf=1" "rs=", (Cache flush) SRV ae04ea60-8ad9-3020-3aa0-73e6cadc29a2.local.:8009 0 0, (Cache flush) A 192.168.0.42 (351)
E..{_.@...y....*.........g..............._googlecast._tcp.local........x.0-Var..se-Core-ae04ea608ad930203aa073e6cadc29a2..............#id=ae04ea608ad930203aa073e6cadc29a2#cd=28AA0C4D4657250977621E58AD331DCF.rm=.ve=05.md=Var..se Core.ic=/setup/icon.png.fn=Living room	ca=199172.st=0.bs=FA8FCA6A0F32.nf=1.rs=...!.....x.-.....I$ae04ea60-8ad9-3020-3aa0-73e6cadc29a2...(.......x.....*
13:43:30.701734 IP varese-interface-501e2d68ee7a.home.mdns > mdns.mcast.net.mdns: 0*- [0q] 4/0/0 PTR ae04ea60-8ad9-3020-3aa0-73e6cadc29a2._googlezone._tcp.local., (Cache flush) TXT "id=28AA0C4D4657250977621E58AD331DCF" "CGS", (Cache flush) SRV ae04ea60-8ad9-3020-3aa0-73e6cadc29a2.local.:10001 700 0, (Cache flush) A 192.168.0.42 (210)
E..._.@...y....*...........?............._googlezone._tcp.local........x.'$ae04ea60-8ad9-3020-3aa0-73e6cadc29a2.............(#id=28AA0C4D4657250977621E58AD331DCF.CGS...!.....x.-....'.$ae04ea60-8ad9-3020-3aa0-73e6cadc29a2...........x.....*
13:43:31.817825 IP varese-interface-501e2d68ee7a.home.mdns > mdns.mcast.net.mdns: 0 [2q] [3n] ANY (QM)? ae04ea60-8ad9-3020-3aa0-73e6cadc29a2._googlezone._tcp.local. ANY (QM)? ae04ea60-8ad9-3020-3aa0-73e6cadc29a2.local. (208)
E...`e@...x....*........................$ae04ea60-8ad9-3020-3aa0-73e6cadc29a2._googlezone._tcp.local.....$ae04ea60-8ad9-3020-3aa0-73e6cadc29a2.B...............(#id=28AA0C4D4657250977621E58AD331DCF.CGS...!.....x......'..M.M.......x.....*
13:43:32.020841 IP varese-interface-501e2d68ee7a.home.mdns > mdns.mcast.net.mdns: 0 [2q] [3n] ANY (QM)? VarM-CM-(se-Core-ae04ea608ad930203aa073e6cadc29a2._googlecast._tcp.local. ANY (QM)? ae04ea60-8ad9-3020-3aa0-73e6cadc29a2.local. (349)
E..y`.@...x....*.........e..............-Var..se-Core-ae04ea608ad930203aa073e6cadc29a2._googlecast._tcp.local.....$ae04ea60-8ad9-3020-3aa0-73e6cadc29a2.K................#id=ae04ea608ad930203aa073e6cadc29a2#cd=28AA0C4D4657250977621E58AD331DCF.rm=.ve=05.md=Var..se Core.ic=/setup/icon.png.fn=Living room	ca=199172.st=0.bs=FA8FCA6A0F32.nf=1.rs=...!.....x.......I.V.V.......x.....*
13:43:32.026308 IP varese-interface-501e2d68ee7a.home.mdns > mdns.mcast.net.mdns: 0 [2q] [3n] ANY (QM)? ae04ea60-8ad9-3020-3aa0-73e6cadc29a2._googlezone._tcp.local. ANY (QM)? ae04ea60-8ad9-3020-3aa0-73e6cadc29a2.local. (208)
E...`.@...x....*........................$ae04ea60-8ad9-3020-3aa0-73e6cadc29a2._googlezone._tcp.local.....$ae04ea60-8ad9-3020-3aa0-73e6cadc29a2.B...............(#id=28AA0C4D4657250977621E58AD331DCF.CGS...!.....x......'..M.M.......x.....*
13:43:32.323966 IP varese-interface-501e2d68ee7a.home.mdns > mdns.mcast.net.mdns: 0 [2q] [3n] ANY (QM)? VarM-CM-(se-Core-ae04ea608ad930203aa073e6cadc29a2._googlecast._tcp.local. ANY (QM)? ae04ea60-8ad9-3020-3aa0-73e6cadc29a2.local. (349)
E..y`.@...w....*.........e..............-Var..se-Core-ae04ea608ad930203aa073e6cadc29a2._googlecast._tcp.local.....$ae04ea60-8ad9-3020-3aa0-73e6cadc29a2.K................#id=ae04ea608ad930203aa073e6cadc29a2#cd=28AA0C4D4657250977621E58AD331DCF.rm=.ve=05.md=Var..se Core.ic=/setup/icon.png.fn=Living room	ca=199172.st=0.bs=FA8FCA6A0F32.nf=1.rs=...!.....x.......I.V.V.......x.....*
13:43:32.334308 IP varese-interface-501e2d68ee7a.home.mdns > mdns.mcast.net.mdns: 0 [2q] [3n] ANY (QM)? ae04ea60-8ad9-3020-3aa0-73e6cadc29a2._googlezone._tcp.local. ANY (QM)? ae04ea60-8ad9-3020-3aa0-73e6cadc29a2.local. (208)
E...`.@...xa...*........................$ae04ea60-8ad9-3020-3aa0-73e6cadc29a2._googlezone._tcp.local.....$ae04ea60-8ad9-3020-3aa0-73e6cadc29a2.B...............(#id=28AA0C4D4657250977621E58AD331DCF.CGS...!.....x......'..M.M.......x.....*
13:43:33.559596 IP varese-interface-501e2d68ee7a.home.mdns > mdns.mcast.net.mdns: 0*- [0q] 4/0/0 PTR ae04ea60-8ad9-3020-3aa0-73e6cadc29a2._googlezone._tcp.local., (Cache flush) TXT "id=28AA0C4D4657250977621E58AD331DCF" "CGS", (Cache flush) SRV ae04ea60-8ad9-3020-3aa0-73e6cadc29a2.local.:10001 700 0, (Cache flush) A 192.168.0.42 (210)
E...a~@...w....*...........?............._googlezone._tcp.local........x.'$ae04ea60-8ad9-3020-3aa0-73e6cadc29a2.............(#id=28AA0C4D4657250977621E58AD331DCF.CGS...!.....x.-....'.$ae04ea60-8ad9-3020-3aa0-73e6cadc29a2...........x.....*
13:43:34.576846 IP varese-interface-501e2d68ee7a.home.mdns > mdns.mcast.net.mdns: 0 [2q] [3n] ANY (QM)? VarM-CM-(se-Core-ae04ea608ad930203aa073e6cadc29a2._googlecast._tcp.local. ANY (QM)? ae04ea60-8ad9-3020-3aa0-73e6cadc29a2.local. (349)
E..ya.@...v....*.........e..............-Var..se-Core-ae04ea608ad930203aa073e6cadc29a2._googlecast._tcp.local.....$ae04ea60-8ad9-3020-3aa0-73e6cadc29a2.K................#id=ae04ea608ad930203aa073e6cadc29a2#cd=28AA0C4D4657250977621E58AD331DCF.rm=.ve=05.md=Var..se Core.ic=/setup/icon.png.fn=Living room	ca=199172.st=0.bs=FA8FCA6A0F32.nf=1.rs=...!.....x.......I.V.V.......x.....*
13:43:34.583270 IP varese-interface-501e2d68ee7a.home.mdns > mdns.mcast.net.mdns: 0 [2q] [3n] ANY (QM)? ae04ea60-8ad9-3020-3aa0-73e6cadc29a2._googlezone._tcp.local. ANY (QM)? ae04ea60-8ad9-3020-3aa0-73e6cadc29a2.local. (208)
E...a.@...wH...*........................$ae04ea60-8ad9-3020-3aa0-73e6cadc29a2._googlezone._tcp.local.....$ae04ea60-8ad9-3020-3aa0-73e6cadc29a2.B...............(#id=28AA0C4D4657250977621E58AD331DCF.CGS...!.....x......'..M.M.......x.....*
13:43:34.786602 IP varese-interface-501e2d68ee7a.home.mdns > mdns.mcast.net.mdns: 0 [2q] [3n] ANY (QM)? VarM-CM-(se-Core-ae04ea608ad930203aa073e6cadc29a2._googlecast._tcp.local. ANY (QM)? ae04ea60-8ad9-3020-3aa0-73e6cadc29a2.local. (349)
E..ya.@...v....*.........e..............-Var..se-Core-ae04ea608ad930203aa073e6cadc29a2._googlecast._tcp.local.....$ae04ea60-8ad9-3020-3aa0-73e6cadc29a2.K................#id=ae04ea608ad930203aa073e6cadc29a2#cd=28AA0C4D4657250977621E58AD331DCF.rm=.ve=05.md=Var..se Core.ic=/setup/icon.png.fn=Living room	ca=199172.st=0.bs=FA8FCA6A0F32.nf=1.rs=...!.....x.......I.V.V.......x.....*
13:43:34.792048 IP varese-interface-501e2d68ee7a.home.mdns > mdns.mcast.net.mdns: 0 [2q] [3n] ANY (QM)? ae04ea60-8ad9-3020-3aa0-73e6cadc29a2._googlezone._tcp.local. ANY (QM)? ae04ea60-8ad9-3020-3aa0-73e6cadc29a2.local. (208)
E...a.@...w6...*........................$ae04ea60-8ad9-3020-3aa0-73e6cadc29a2._googlezone._tcp.local.....$ae04ea60-8ad9-3020-3aa0-73e6cadc29a2.B...............(#id=28AA0C4D4657250977621E58AD331DCF.CGS...!.....x......'..M.M.......x.....*
13:43:35.094840 IP varese-interface-501e2d68ee7a.home.mdns > mdns.mcast.net.mdns: 0 [2q] [3n] ANY (QM)? VarM-CM-(se-Core-ae04ea608ad930203aa073e6cadc29a2._googlecast._tcp.local. ANY (QM)? ae04ea60-8ad9-3020-3aa0-73e6cadc29a2.local. (349)
E..yb	@...v....*.........e..............-Var..se-Core-ae04ea608ad930203aa073e6cadc29a2._googlecast._tcp.local.....$ae04ea60-8ad9-3020-3aa0-73e6cadc29a2.K................#id=ae04ea608ad930203aa073e6cadc29a2#cd=28AA0C4D4657250977621E58AD331DCF.rm=.ve=05.md=Var..se Core.ic=/setup/icon.png.fn=Living room	ca=199172.st=0.bs=FA8FCA6A0F32.nf=1.rs=...!.....x.......I.V.V.......x.....*
13:43:35.100290 IP varese-interface-501e2d68ee7a.home.mdns > mdns.mcast.net.mdns: 0 [2q] [3n] ANY (QM)? ae04ea60-8ad9-3020-3aa0-73e6cadc29a2._googlezone._tcp.local. ANY (QM)? ae04ea60-8ad9-3020-3aa0-73e6cadc29a2.local. (208)
E...b
@...w(...*........................$ae04ea60-8ad9-3020-3aa0-73e6cadc29a2._googlezone._tcp.local.....$ae04ea60-8ad9-3020-3aa0-73e6cadc29a2.B...............(#id=28AA0C4D4657250977621E58AD331DCF.CGS...!.....x......'..M.M.......x.....*
13:43:36.321613 IP varese-interface-501e2d68ee7a.home.mdns > mdns.mcast.net.mdns: 0*- [0q] 4/0/0 PTR VarM-CM-(se-Core-ae04ea608ad930203aa073e6cadc29a2._googlecast._tcp.local., (Cache flush) TXT "id=ae04ea608ad930203aa073e6cadc29a2" "cd=28AA0C4D4657250977621E58AD331DCF" "rm=" "ve=05" "md=VarM-CM-(se Core" "ic=/setup/icon.png" "fn=Living room" "ca=199172" "st=0" "bs=FA8FCA6A0F32" "nf=1" "rs=", (Cache flush) SRV ae04ea60-8ad9-3020-3aa0-73e6cadc29a2.local.:8009 0 0, (Cache flush) A 192.168.0.42 (351)
E..{b.@...u....*.........g..............._googlecast._tcp.local........x.0-Var..se-Core-ae04ea608ad930203aa073e6cadc29a2..............#id=ae04ea608ad930203aa073e6cadc29a2#cd=28AA0C4D4657250977621E58AD331DCF.rm=.ve=05.md=Var..se Core.ic=/setup/icon.png.fn=Living room	ca=199172.st=0.bs=FA8FCA6A0F32.nf=1.rs=...!.....x.-.....I$ae04ea60-8ad9-3020-3aa0-73e6cadc29a2...(.......x.....*
13:43:36.327012 IP varese-interface-501e2d68ee7a.home.mdns > mdns.mcast.net.mdns: 0*- [0q] 4/0/0 PTR ae04ea60-8ad9-3020-3aa0-73e6cadc29a2._googlezone._tcp.local., (Cache flush) TXT "id=28AA0C4D4657250977621E58AD331DCF" "CGS", (Cache flush) SRV ae04ea60-8ad9-3020-3aa0-73e6cadc29a2.local.:10001 700 0, (Cache flush) A 192.168.0.42 (210)
E...b.@...vH...*...........?............._googlezone._tcp.local........x.'$ae04ea60-8ad9-3020-3aa0-73e6cadc29a2.............(#id=28AA0C4D4657250977621E58AD331DCF.CGS...!.....x.-....'.$ae04ea60-8ad9-3020-3aa0-73e6cadc29a2...........x.....*
13:43:37.448623 IP varese-interface-501e2d68ee7a.home.mdns > mdns.mcast.net.mdns: 0 [2q] [3n] ANY (QM)? VarM-CM-(se-Core-ae04ea608ad930203aa073e6cadc29a2._googlecast._tcp.local. ANY (QM)? ae04ea60-8ad9-3020-3aa0-73e6cadc29a2.local. (349)
E..yc.@...t....*.........e..............-Var..se-Core-ae04ea608ad930203aa073e6cadc29a2._googlecast._tcp.local.....$ae04ea60-8ad9-3020-3aa0-73e6cadc29a2.K................#id=ae04ea608ad930203aa073e6cadc29a2#cd=28AA0C4D4657250977621E58AD331DCF.rm=.ve=05.md=Var..se Core.ic=/setup/icon.png.fn=Living room	ca=199172.st=0.bs=FA8FCA6A0F32.nf=1.rs=...!.....x.......I.V.V.......x.....*
13:43:37.454218 IP varese-interface-501e2d68ee7a.home.mdns > mdns.mcast.net.mdns: 0 [2q] [3n] ANY (QM)? ae04ea60-8ad9-3020-3aa0-73e6cadc29a2._googlezone._tcp.local. ANY (QM)? ae04ea60-8ad9-3020-3aa0-73e6cadc29a2.local. (208)
E...c.@...u|...*........................$ae04ea60-8ad9-3020-3aa0-73e6cadc29a2._googlezone._tcp.local.....$ae04ea60-8ad9-3020-3aa0-73e6cadc29a2.B...............(#id=28AA0C4D4657250977621E58AD331DCF.CGS...!.....x......'..M.M.......x.....*
13:43:37.652754 IP varese-interface-501e2d68ee7a.home.mdns > mdns.mcast.net.mdns: 0 [2q] [3n] ANY (QM)? VarM-CM-(se-Core-ae04ea608ad930203aa073e6cadc29a2._googlecast._tcp.local. ANY (QM)? ae04ea60-8ad9-3020-3aa0-73e6cadc29a2.local. (349)
E..yc.@...t....*.........e..............-Var..se-Core-ae04ea608ad930203aa073e6cadc29a2._googlecast._tcp.local.....$ae04ea60-8ad9-3020-3aa0-73e6cadc29a2.K................#id=ae04ea608ad930203aa073e6cadc29a2#cd=28AA0C4D4657250977621E58AD331DCF.rm=.ve=05.md=Var..se Core.ic=/setup/icon.png.fn=Living room	ca=199172.st=0.bs=FA8FCA6A0F32.nf=1.rs=...!.....x.......I.V.V.......x.....*
13:43:37.658496 IP varese-interface-501e2d68ee7a.home.mdns > mdns.mcast.net.mdns: 0 [2q] [3n] ANY (QM)? ae04ea60-8ad9-3020-3aa0-73e6cadc29a2._googlezone._tcp.local. ANY (QM)? ae04ea60-8ad9-3020-3aa0-73e6cadc29a2.local. (208)
E...c.@...u;...*........................$ae04ea60-8ad9-3020-3aa0-73e6cadc29a2._googlezone._tcp.local.....$ae04ea60-8ad9-3020-3aa0-73e6cadc29a2.B...............(#id=28AA0C4D4657250977621E58AD331DCF.CGS...!.....x......'..M.M.......x.....*
13:43:37.857687 IP varese-interface-501e2d68ee7a.home.mdns > mdns.mcast.net.mdns: 0 [2q] [3n] ANY (QM)? VarM-CM-(se-Core-ae04ea608ad930203aa073e6cadc29a2._googlecast._tcp.local. ANY (QM)? ae04ea60-8ad9-3020-3aa0-73e6cadc29a2.local. (349)
E..yd.@...t....*.........e..............-Var..se-Core-ae04ea608ad930203aa073e6cadc29a2._googlecast._tcp.local.....$ae04ea60-8ad9-3020-3aa0-73e6cadc29a2.K................#id=ae04ea608ad930203aa073e6cadc29a2#cd=28AA0C4D4657250977621E58AD331DCF.rm=.ve=05.md=Var..se Core.ic=/setup/icon.png.fn=Living room	ca=199172.st=0.bs=FA8FCA6A0F32.nf=1.rs=...!.....x.......I.V.V.......x.....*
13:43:37.863379 IP varese-interface-501e2d68ee7a.home.mdns > mdns.mcast.net.mdns: 0 [2q] [3n] ANY (QM)? ae04ea60-8ad9-3020-3aa0-73e6cadc29a2._googlezone._tcp.local. ANY (QM)? ae04ea60-8ad9-3020-3aa0-73e6cadc29a2.local. (208)
E...d.@...u....*........................$ae04ea60-8ad9-3020-3aa0-73e6cadc29a2._googlezone._tcp.local.....$ae04ea60-8ad9-3020-3aa0-73e6cadc29a2.B...............(#id=28AA0C4D4657250977621E58AD331DCF.CGS...!.....x......'..M.M.......x.....*
13:43:39.188786 IP varese-interface-501e2d68ee7a.home.mdns > mdns.mcast.net.mdns: 0*- [0q] 4/0/0 PTR VarM-CM-(se-Core-ae04ea608ad930203aa073e6cadc29a2._googlecast._tcp.local., (Cache flush) TXT "id=ae04ea608ad930203aa073e6cadc29a2" "cd=28AA0C4D4657250977621E58AD331DCF" "rm=" "ve=05" "md=VarM-CM-(se Core" "ic=/setup/icon.png" "fn=Living room" "ca=199172" "st=0" "bs=FA8FCA6A0F32" "nf=1" "rs=", (Cache flush) SRV ae04ea60-8ad9-3020-3aa0-73e6cadc29a2.local.:8009 0 0, (Cache flush) A 192.168.0.42 (351)
E..{d.@...t....*.........g..............._googlecast._tcp.local........x.0-Var..se-Core-ae04ea608ad930203aa073e6cadc29a2..............#id=ae04ea608ad930203aa073e6cadc29a2#cd=28AA0C4D4657250977621E58AD331DCF.rm=.ve=05.md=Var..se Core.ic=/setup/icon.png.fn=Living room	ca=199172.st=0.bs=FA8FCA6A0F32.nf=1.rs=...!.....x.-.....I$ae04ea60-8ad9-3020-3aa0-73e6cadc29a2...(.......x.....*
13:43:39.194284 IP varese-interface-501e2d68ee7a.home.mdns > mdns.mcast.net.mdns: 0*- [0q] 4/0/0 PTR ae04ea60-8ad9-3020-3aa0-73e6cadc29a2._googlezone._tcp.local., (Cache flush) TXT "id=28AA0C4D4657250977621E58AD331DCF" "CGS", (Cache flush) SRV ae04ea60-8ad9-3020-3aa0-73e6cadc29a2.local.:10001 700 0, (Cache flush) A 192.168.0.42 (210)
E...d.@...t....*...........?............._googlezone._tcp.local........x.'$ae04ea60-8ad9-3020-3aa0-73e6cadc29a2.............(#id=28AA0C4D4657250977621E58AD331DCF.CGS...!.....x.-....'.$ae04ea60-8ad9-3020-3aa0-73e6cadc29a2...........x.....*

